"original_text","perturbed_text","original_score","perturbed_score","original_output","perturbed_output","ground_truth_output","num_queries","result_type"
"McNealy: Microsoft needs Sun to beat IBM and Red Hat Whatever pleasantries once existed between [[Sun]] [[Microsystems]] and Red [[Hat]] have [[vanished]]. This won #39;t come as a shock to many of you.","McNealy: Microsoft needs Sun to beat IBM and Red Hat Whatever pleasantries once existed between [[Suո]] [[Microsystemѕ]] and Red [[Ha𝚝]] have [[vanisհed]]. This won #39;t come as a shock to many of you.",0.28955745697021484,0.8766646981239319,3,2,3,55,"Successful"
"Democrats [[Question]] [[Kerry's]] Campaign Funds [[Democratic]] Party leaders said Wednesday they want to know why Sen. John [[Kerry]] [[ended]] his presidential [[campaign]] with more than \$15 million in the bank, money that could have helped Democratic candidates across the country.","Democrats [[Qeustion]] [[Keryr's]] Campaign Funds [[Democra𝚝ic]] Party leaders said Wednesday they want to know why Sen. John [[Kerⲅy]] [[end]] [[ed]] his presidential [[caｍpaign]] with more than \$15 million in the bank, money that could have helped Democratic candidates across the country.",0.17467963695526123,0.6239671111106873,0,2,0,85,"Successful"
"Informed and [[Awaiting]] a [[St]]. Helens Eruption The people who remember the eruption of Mount [[St]]. Helens in 1980 are not as fearful as they were then, with scientists predicting a less powerful eruption.","Informed and [[Awai𝚝ing]] a [[S𝚝]]. Helens Eruption The people who remember the eruption of Mount [[S𝚝]]. Helens in 1980 are not as fearful as they were then, with scientists predicting a less powerful eruption.",0.2660638093948364,0.8204218745231628,3,0,3,32,"Successful"
"US, Allies Far Apart on Iraq Debt Relief WASHINGTON Oct. 2, 2004 - The United States and its major economic allies struggled Saturday to resolve deep differences over how best to relieve the heavy debt burden for Iraq and the world #39;s poorest countries.","US, Allies Far Apart on Iraq Debt Relief WASHINGTON Oct. 2, 2004 - The United States and its major economic allies struggled Saturday to resolve deep differences over how best to relieve the heavy debt burden for Iraq and the world #39;s poorest countries.",0.5758795142173767,0.5758795142173767,0,0,2,1,"Skipped"
"President [[Susilo]] stresses fighting against graft, [[terror]] as &lt;b&gt;...&[[lt]];/b&gt; In [[line]] with his pledge [[made]] during the [[election]] [[campaign]], [[Indonesian]] [[new]] President Susilo Bambang [[Yudhoyono]] stressed the importance of fighting corruption and terror while ","President [[Susilо]] stresses fighting against graft, [[terroⲅ]] as &lt;b&gt;...&[[l𝚝]];/b&gt; In [[lnie]] with his pledge [[mae]] during the [[elec𝚝ion]] [[caｍpaign]], [[Indоnesian]] [[neԝ]] President Susilo Bambang [[Yuԁhoyono]] stressed the importance of fighting corruption and terror while ",0.17413461208343506,0.208695650100708,0,0,0,159,"Failed"
"MSN Enters Blogging [[Fray]] with  quot;Spaces quot; Microsoft #39;s MSN has introduced a beta version of its [[new]] blogging tool, [[MSN]] Spaces, which it expects will eventually be supported by advertising.","MSN Enters Blogging [[Fry]] with  quot;Spaces quot; Microsoft #39;s MSN has introduced a beta version of its [[neԝ]] blogging tool, [[M]] [[SN]] Spaces, which it expects will eventually be supported by advertising.",0.2293928861618042,0.26170462369918823,3,3,3,140,"Failed"
"[[Wal-Mart]] Keeps [[Same-Store]] Sales Outlook  [[CHICAGO]] ([[Reuters]]) - [[Wal-Mart]] [[Stores]] Inc. &[[lt]];A [[HREF]]=""[[http]]://www.investor.reuters.[[com]]/FullQuote.[[aspx]]?[[ticker]]=[[WMT]].N [[target]]=/[[stocks]]/quickinfo/fullquote""&gt;WMT.N&lt;/A&gt;, the  world's [[largest]] retailer, said on Saturday it still anticipates  a 2 percent to 4 percent increase in November sales at its  stores open at least a year.","[[Wal˗Mart]] Keeps [[Same˗Store]] Sales Outlook  [[CHCIAGO]] ([[Reսters]]) - [[Wal˗Mart]] [[Storeѕ]] Inc. &[[l𝚝]];A [[H]] [[REF]]=""[[ht𝚝p]]://www.investor.reuters.[[cm]]/FullQuote.[[asp×]]?[[tiker]]=[[WT]].N [[targe𝚝]]=/[[stockѕ]]/quickinfo/fullquote""&gt;WMT.N&lt;/A&gt;, the  world's [[larg]] [[est]] retailer, said on Saturday it still anticipates  a 2 percent to 4 percent increase in November sales at its  stores open at least a year.",0.14713358879089355,0.2586062550544739,2,2,2,210,"Failed"
"Approval Expected for Big Cellphone Deal Federal regulators will formally approve Cingular Wireless #39;s \$41 billion purchase of AT amp;T Wireless today, company officials briefed on the matter said over the weekend.","Approval Expected for Big Cellphone Deal Federal regulators will formally approve Cingular Wireless #39;s \$41 billion purchase of AT amp;T Wireless today, company officials briefed on the matter said over the weekend.",0.939601719379425,0.939601719379425,2,2,3,1,"Skipped"
"[[Fannie]] Mae mess worries investors [[The]] fallout from [[allegations]] of serious accounting problems at Fannie Mae has rattled investors and could [[even]] bump up [[mortgage]] rates down the road.","[[Fanie]] Mae mess worries investors [[T]] [[he]] fallout from [[allegationѕ]] of serious accounting problems at Fannie Mae has rattled investors and could [[eѵen]] bump up [[mor𝚝gage]] rates down the road.",0.15850472450256348,0.16316735744476318,2,2,2,146,"Failed"
"Paper says Merck hid data on [[Vioxx]] WHITEHOUSE STATION, NJ - Shares of Merck  amp; Co. plunged nearly 10 percent Monday after a media report [[said]] documents show the pharmaceutical giant hid or denied evidence for years that its [[blockbuster]] [[arthritis]] drug [[Vioxx]] causes [[heart]] [[problems]].","Paper says Merck hid data on [[Voixx]] WHITEHOUSE STATION, NJ - Shares of Merck  amp; Co. plunged nearly 10 percent Monday after a media report [[sid]] documents show the pharmaceutical giant hid or denied evidence for years that its [[blockbustеr]] [[artհritis]] drug [[Voxx]] causes [[hart]] [[prob]] [[lems]].",0.17568176984786987,0.7224336862564087,2,3,2,312,"Successful"
"To learn more LNM [[Holdings]] has steelmaking [[operations]] in eight [[countries]] with an annual steel production capacity of more than 32 [[million]] tons. ISG was formed in 2002 and [[bought]] the assets of bankrupt [[Bethlehem]] [[Steel]] [[Corp]] ","To learn more LNM [[Holdingѕ]] has steelmaking [[operationѕ]] in eight [[countriеs]] with an annual steel production capacity of more than 32 [[milⅼion]] tons. ISG was formed in 2002 and [[bough𝚝]] the assets of bankrupt [[Bethleheｍ]] [[Steeⅼ]] [[Coⲅp]] ",0.20264405012130737,0.7151597738265991,2,3,2,154,"Successful"
"IBM reported to be exiting PC business [[IBM]] #39;s possible exit from the [[personal-computer]] business would be the latest move in what amounts to a long goodbye from a field it pioneered and revolutionized.","IBM reported to be exiting PC business [[IM]] #39;s possible exit from the [[persoոal-computer]] business would be the latest move in what amounts to a long goodbye from a field it pioneered and revolutionized.",0.2340189814567566,0.8166460990905762,2,3,2,43,"Successful"
"[[Singapore]] [[Shares]] [[End]] Up on [[Wall]] St. Gains Singapore [[shares]] [[ended]] [[higher]] Tuesday boosted by [[modest]] overnight gains on Wall Street and easing oil prices, traders said. The United States is a major trading partner and the local stock market traditionally ","[[Sngapore]] [[Sh]] [[ares]] [[Ed]] Up on [[Wlal]] St. Gains Singapore [[shareѕ]] [[endeԁ]] [[hihger]] Tuesday boosted by [[modet]] overnight gains on Wall Street and easing oil prices, traders said. The United States is a major trading partner and the local stock market traditionally ",0.1603373885154724,0.3497534990310669,2,2,2,227,"Failed"
"Lockheed to Launch Rocket; [[Boeing]] [[Gets]] [[New]] [[Date]] (Reuters) [[Reuters]] - [[Lockheed]] Martin Corp. on Monday\announced that it will launch its Atlas V [[rocket]] on Dec. [[17]] as\[[planned]], while Boeing Co. waited to [[reschedule]] a launch of its\Delta IV [[heavy-lift]] rocket that it was forced to [[abandon]] on\Sunday.","Lockheed to Launch Rocket; [[Being]] [[Getѕ]] [[Nw]] [[Da𝚝e]] (Reuters) [[Reuterѕ]] - [[Lockհeed]] Martin Corp. on Monday\announced that it will launch its Atlas V [[rocke𝚝]] on Dec. [[1𝟕]] as\[[planneԁ]], while Boeing Co. waited to [[reschedսle]] a launch of its\Delta IV [[heavy-lfit]] rocket that it was forced to [[aband]] [[on]] on\Sunday.",0.1878231167793274,0.8214579224586487,3,2,3,176,"Successful"
"[[Index]]: RP [[institutions]] among cellar dwellers The countrys public [[institutions]] were ranked the [[sixth]] least effective in the world in the latest [[survey]] of the World Economic Forum (WER), which measured the capacity for growth of 104 economies this year.","[[Idex]]: RP [[іnstitutions]] among cellar dwellers The countrys public [[institutionѕ]] were ranked the [[sіxth]] least effective in the world in the latest [[surveу]] of the World Economic Forum (WER), which measured the capacity for growth of 104 economies this year.",0.155684232711792,0.6914964914321899,2,1,2,82,"Successful"
"GOP Jamboree May Give [[Stocks]] Brief Lift  [[NEW]] [[YORK]] ([[Reuters]]) - Fasten your seatbelts. The Republicans  are in town. If things go smoothly at the Republican National  Convention, the [[stock]] [[market]] could [[get]] a brief boost this week,  experts say.","GOP Jamboree May Give [[Stоcks]] Brief Lift  [[N]] [[EW]] [[YRK]] ([[Reut]] [[ers]]) - Fasten your seatbelts. The Republicans  are in town. If things go smoothly at the Republican National  Convention, the [[stck]] [[marekt]] could [[gt]] a brief boost this week,  experts say.",0.16404742002487183,0.8627284169197083,2,0,2,157,"Successful"
"Orion Debuts Cluster Workstation Orion Multisystems, a new [[company]] founded by former Transmeta (Quote, Chart) [[executives]], debuted a family of [[workstations]] Monday that [[think]] and [[act]] like a cluster of [[servers]].","Orion Debuts Cluster Workstation Orion Multisystems, a new [[compaոy]] founded by former Transmeta (Quote, Chart) [[executiveѕ]], debuted a family of [[worksations]] Monday that [[thіnk]] and [[ac𝚝]] like a cluster of [[serves]].",0.25995850563049316,0.650227427482605,3,2,3,101,"Successful"
"Auction for [[Yukos]] core [[set]] for Dec. 19 A [[planned]] sale of Russian energy [[giant]] [[Yukos]] #39; [[main]] [[asset]] has become clouded by confusion over the price, the [[participants]] and the legality of the sale.","Auction for [[Yuks]] core [[se𝚝]] for Dec. 19 A [[planneԁ]] sale of Russian energy [[gant]] [[Yuks]] #39; [[ｍain]] [[asse𝚝]] has become clouded by confusion over the price, the [[participantѕ]] and the legality of the sale.",0.1575724482536316,0.21910619735717773,2,2,2,96,"Failed"
"HP drops [[Itanium]] development Hewlett-Packard Co. (HP) is getting out of the [[chip-making]] business. The Palo Alto, California, company on Thursday announced that it reached an agreement with Intel Corp.","HP drops [[Itɑnium]] development Hewlett-Packard Co. (HP) is getting out of the [[chip˗making]] business. The Palo Alto, California, company on Thursday announced that it reached an agreement with Intel Corp.",0.20135825872421265,0.7351492643356323,3,2,3,45,"Successful"
"[[SEC]] [[Wants]] Fixes, Instead of  Fines Rather than rapping knuckles after [[abuse]] is uncovered, chairman [[William]] H. Donaldson wants the SEC staff to work with and get to know [[Wall]] Street well enough to get the jump on problems before  investors lose money.","[[S]] [[EC]] [[Wan]] [[ts]] Fixes, Instead of  Fines Rather than rapping knuckles after [[abu]] [[se]] is uncovered, chairman [[Williaｍ]] H. Donaldson wants the SEC staff to work with and get to know [[Wal]] Street well enough to get the jump on problems before  investors lose money.",0.16405630111694336,0.24444830417633057,2,2,2,143,"Failed"
"[[Israel's]] Labour to Join [[Sharon]] [[Coalition-Israeli]] Media  JERUSALEM (Reuters) - Israel's opposition [[Labour]] party has  clinched a deal with Prime Minister [[Ariel]] [[Sharon's]] Likud party  to [[join]] his coalition, a [[move]] that could push forward his [[Gaza]]  [[pullout]] plan, [[Israeli]] media [[reported]] on Friday.","[[Israel`s]] Labour to Join [[Shaⲅon]] [[Coalition-]] [[Israeli]] Media  JERUSALEM (Reuters) - Israel's opposition [[Labouⲅ]] party has  clinched a deal with Prime Minister [[Arieⅼ]] [[Shaⲅon's]] Likud party  to [[ϳoin]] his coalition, a [[moѵe]] that could push forward his [[Gzaa]]  [[pull]] [[out]] plan, [[Israelі]] media [[rep]] [[orted]] on Friday.",0.182966947555542,0.2222287654876709,0,0,0,252,"Failed"
"[[Straw]]: No British troops to Darfur British Foreign Minister Jack Straw said his country does not [[plan]] to deploy forces to [[Darfur]] in [[western]] Sudan but will [[provide]] [[technical]] assistance.","[[Sraw]]: No British troops to Darfur British Foreign Minister Jack Straw said his country does not [[plɑn]] to deploy forces to [[Darufr]] in [[westerո]] Sudan but will [[prvide]] [[technicɑl]] assistance.",0.1753079891204834,0.7409141063690186,0,1,0,116,"Successful"
"Molson Will Pay Dividend to Push Through [[Coors]] Merger ([[Update6]]) Molson Inc., [[Canada]] #[[39]];s [[biggest]] [[beermaker]], said it will pay minority shareholders a special dividend to [[overcome]] [[opposition]] to its planned C\$[[3]].","Molson Will Pay Dividend to Push Through [[Cоors]] Merger ([[Upda𝚝e6]]) Molson Inc., [[Canaԁa]] #[[3৭]];s [[bigges𝚝]] [[beermakeⲅ]], said it will pay minority shareholders a special dividend to [[overcoｍe]] [[opposi𝚝ion]] to its planned C\$[[Ʒ]].",0.1514190435409546,0.29183924198150635,2,2,2,230,"Failed"
"CE giants  #39;[[readying]] Blu-ray camcorders #39; [[Sony]], Sharp and Matsushita plan to offer camcorders [[based]] on a [[cut-down]] [[version]] of the Blu-ray [[Disc]], and [[could]] announce product as [[early]] as [[next]] [[year]].","CE giants  #39;[[redying]] Blu-ray camcorders #39; [[Snoy]], Sharp and Matsushita plan to offer camcorders [[Ьased]] on a [[ct-down]] [[veⲅsion]] of the Blu-ray [[Dіsc]], and [[cou]] [[ld]] announce product as [[erly]] as [[net]] [[yeaⲅ]].",0.17148232460021973,0.3516232967376709,3,3,3,103,"Failed"
"Human Gene [[Total]] Falls Below 25,000 A new report from the international consortium of [[laboratories]] that decoded the human [[genome]] has [[revised]] the estimated [[number]] of human genes [[sharply]] downward.","Human Gene [[Totaⅼ]] Falls Below 25,000 A new report from the international consortium of [[laborɑtories]] that decoded the human [[geոome]] has [[reviseԁ]] the estimated [[numb]] [[er]] of human genes [[sharpⅼy]] downward.",0.26459264755249023,0.6422461867332458,3,2,3,118,"Successful"
"Hawks Evicted From New York City Perch (AP) AP - Pale Male the city [[hawk]] was evicted from his nest, and the flap has already begun.","Hawks Evicted From New York City Perch (AP) AP - Pale Male the city [[hwak]] was evicted from his nest, and the flap has already begun.",0.5143003463745117,0.9188183546066284,3,0,3,26,"Successful"
"Manchester United Beats Charlton 2-0 (AP) AP - Manchester United defeated Charlton 2-0 [[Saturday]] in the [[Premier]] League [[behind]] goals from Ryan Giggs and Paul [[Scholes]]. Charlton did little to test United's [[defense]] before 67,704 fans, and the only surprise was that [[Man]] [[United]] didn't score more.","Manchester United Beats Charlton 2-0 (AP) AP - Manchester United defeated Charlton 2-0 [[Saturԁay]] in the [[Premieⲅ]] League [[behid]] goals from Ryan Giggs and Paul [[Sc]] [[holes]]. Charlton did little to test United's [[defenѕe]] before 67,704 fans, and the only surprise was that [[Mn]] [[Uniteԁ]] didn't score more.",0.21426212787628174,0.47915416955947876,1,1,1,231,"Failed"
"[[Dollar]] Dives to Record Low Vs. [[Euro]]  [[LONDON]] ([[Reuters]]) - The [[dollar]] crashed through key barriers  to a record low on the euro and a [[7-month]] low on the yen on  Wednesday, as concern mounted a forthcoming [[G20]] [[finance]]  ministers' meeting would do little to halt its slide.","[[Dollɑr]] Dives to Record Low Vs. [[Euⲅo]]  [[LODNON]] ([[Reսters]]) - The [[doll]] [[ar]] crashed through key barriers  to a record low on the euro and a [[7˗month]] low on the yen on  Wednesday, as concern mounted a forthcoming [[G2O]] [[fnance]]  ministers' meeting would do little to halt its slide.",0.16897112131118774,0.4537965655326843,2,2,2,110,"Failed"
"Russia wants new business partnership with old ally India ([[AFP]]) [[AFP]] - Russia is seeking a new economic partnership to boost a [[decades-old]] friendship with India, [[envisaging]] sophisticated arms sales, [[high-end]] technology swaps and political support on the world stage.","Russia wants new business partnership with old ally India ([[AP]]) [[AP]] - Russia is seeking a new economic partnership to boost a [[decɑdes-old]] friendship with India, [[envisaginɡ]] sophisticated arms sales, [[high-eոd]] technology swaps and political support on the world stage.",0.16832703351974487,0.7499555349349976,0,3,0,73,"Successful"
"Falcons not [[cruising]] at 4-0; they #[[39]];re [[working]] Jim Mora [[thought]] his [[team]] deserved a little [[something]] special. [[His]] Atlanta Falcons, with a thorough 27-10 [[pounding]] of the [[Carolina]] Panthers, had just extended their record to 4-0 for the first time [[since]] [[1986]].","Falcons not [[cruiѕing]] at 4-0; they #[[3৭]];re [[workinɡ]] Jim Mora [[though𝚝]] his [[teaｍ]] deserved a little [[some𝚝hing]] special. [[Hiѕ]] Atlanta Falcons, with a thorough 27-10 [[poսnding]] of the [[Caroliոa]] Panthers, had just extended their record to 4-0 for the first time [[sincе]] [[196]].",0.16703516244888306,0.5710775852203369,1,3,1,170,"Successful"
"US Plutonium Shipment Reaches France Working under tight security from helicopters and police, port crews unloaded US military [[plutonium]] from a British ship on Wednesday after its arrival in northwest [[France]], nuclear industry officials said.","US Plutonium Shipment Reaches France Working under tight security from helicopters and police, port crews unloaded US military [[plutonіum]] from a British ship on Wednesday after its arrival in northwest [[Fraոce]], nuclear industry officials said.",0.18073630332946777,0.9248629808425903,0,2,0,47,"Successful"
"Rams Beat Jets in OT, Clinch Playoff Berth (AP) AP - The [[St]]. Louis Rams won a [[finale]] that, in the end, they needed much more than the [[New]] York Jets. [[Marc]] Bulger threw for 450 yards and three touchdowns and Jeff Wilkins hit a 31-yard field goal with 3:[[03]] left in overtime Sunday to give the Rams a 32-29 [[win]] over the New York Jets, clinching their fourth playoff berth in five seasons under coach Mike [[Martz]].","Rams Beat Jets in OT, Clinch Playoff Berth (AP) AP - The [[S𝚝]]. Louis Rams won a [[finaⅼe]] that, in the end, they needed much more than the [[Neԝ]] York Jets. [[Mac]] Bulger threw for 450 yards and three touchdowns and Jeff Wilkins hit a 31-yard field goal with 3:[[O3]] left in overtime Sunday to give the Rams a 32-29 [[w]] [[in]] over the New York Jets, clinching their fourth playoff berth in five seasons under coach Mike [[M]] [[artz]].",0.24506980180740356,0.4070432186126709,1,1,1,380,"Failed"
"Phone fight against home violence A campaign begins to collect old [[mobile]] phones and convert them into alarms for women who are attacked in the home.","Phone fight against home violence A campaign begins to collect old [[moblie]] phones and convert them into alarms for women who are attacked in the home.",0.30351072549819946,0.7995293140411377,3,0,3,26,"Successful"
"B.C. Mountie [[killed]] in stolen truck [[crash]] leaves wife, two small children ([[Canadian]] [[Press]]) [[Canadian]] [[Press]] - VERNON, B.C. (CP) - Vernon RCMP have [[identified]] the auxiliary officer killed when the [[cruiser]] in which he was riding was [[struck]] by a stolen [[truck]] as [[Glen]] Evely, 39.","B.C. Mountie [[killeԁ]] in stolen truck [[craѕh]] leaves wife, two small children ([[Canaԁian]] [[Prеss]]) [[Canadіan]] [[Prеss]] - VERNON, B.C. (CP) - Vernon RCMP have [[iedntified]] the auxiliary officer killed when the [[crui]] [[ser]] in which he was riding was [[str]] [[uck]] by a stolen [[trcuk]] as [[Geln]] Evely, 39.",0.177451491355896,0.6669247150421143,0,3,0,148,"Successful"
"Officials to be quizzed in Aragones row Spanish [[Football]] [[Federation]] president Angel Maria Villar will appear before the National Anti-Violence Commission tomorrow to explain why he has defended Spain coach Luis Aragones.","Officials to be quizzed in Aragones row Spanish [[Footbɑll]] [[Federa𝚝ion]] president Angel Maria Villar will appear before the National Anti-Violence Commission tomorrow to explain why he has defended Spain coach Luis Aragones.",0.17176872491836548,0.5561138391494751,1,0,1,45,"Successful"
"Product Previews palmOneUpgrades Treo With Faster Chip, Better Display\With more than 600,000 units shipped, the Treo 600 is one of the big smartphone success stories. Last week, palmOne introduced the follow-on Treo 650 with a higher resolution 320-by-320-pixel TFT screen, which the company claims increases the visible area of the display and makes pictures and documents much clearer. The 650 also carries a removable battery; 32MB of flash memory, and a faster 312MHz, Intel XScale processor. Improved multimedia features include a built-in MP3 player, a digital camera with improved low-light capabilities, as well as video capture and playback functionality. Products are expected to ship by years end from some carriers who will add their own services, and will be priced at about \$499.\ Treo 650, palmOne","Product Previews palmOneUpgrades Treo With Faster Chip, Better Display\With more than 600,000 units shipped, the Treo 600 is one of the big smartphone success stories. Last week, palmOne introduced the follow-on Treo 650 with a higher resolution 320-by-320-pixel TFT screen, which the company claims increases the visible area of the display and makes pictures and documents much clearer. The 650 also carries a removable battery; 32MB of flash memory, and a faster 312MHz, Intel XScale processor. Improved multimedia features include a built-in MP3 player, a digital camera with improved low-light capabilities, as well as video capture and playback functionality. Products are expected to ship by years end from some carriers who will add their own services, and will be priced at about \$499.\ Treo 650, palmOne",0.9455937147140503,0.9455937147140503,3,3,2,1,"Skipped"
"[[Israeli]] tank [[reportedly]] kills Egyptian [[troops]] An [[Israeli]] tank has opened fire and killed three Egyptian troops on the sensitive border between the two countries, [[mistaking]] them for Palestinian militants on the way to carry out an attack, Israeli media says.","[[Isra]] [[eli]] tank [[repоrtedly]] kills Egyptian [[troopѕ]] An [[Isrɑeli]] tank has opened fire and killed three Egyptian troops on the sensitive border between the two countries, [[mistakinɡ]] them for Palestinian militants on the way to carry out an attack, Israeli media says.",0.17384320497512817,0.6083587408065796,0,1,0,88,"Successful"
"Pakistan down India to ensure top six finish (AFP) AFP - Pakistan defeated arch-rivals India 3-0 here to ensure they stand among the top six in the Olympic men's field hockey competition.","Pakistan down India to ensure top six finish (AFP) AFP - Pakistan defeated arch-rivals India 3-0 here to ensure they stand among the top six in the Olympic men's field hockey competition.",0.8351847529411316,0.8351847529411316,1,1,0,1,"Skipped"
"Ichiro Makes Run at [[Historic]] Record Ichiro Suzuki, [[baseball]] #39;s [[sang-froid]] [[player]], is [[racing]] to shatter an [[elusive]] record for hits in a single [[season]], [[aiming]] to bring glory to himself, the Seattle [[Mariners]] and his country Japan.","Ichiro Makes Run at [[Historiϲ]] Record Ichiro Suzuki, [[basebalⅼ]] #39;s [[sang˗froid]] [[playeⲅ]], is [[raϲing]] to shatter an [[eluive]] record for hits in a single [[seaѕon]], [[aiｍing]] to bring glory to himself, the Seattle [[Marinerѕ]] and his country Japan.",0.16868454217910767,0.8128554821014404,1,0,1,230,"Successful"
"[[Baseballer]] shot on [[bus]] CLEVELAND Indians [[righthander]] [[Kyle]] [[Denney]] was reported to be in a stable condition after being shot in the leg on the team bus [[yesterday]].","[[Baseballeⲅ]] shot on [[buѕ]] CLEVELAND Indians [[righthandeⲅ]] [[Kyⅼe]] [[Deney]] was reported to be in a stable condition after being shot in the leg on the team bus [[yesteⲅday]].",0.1652543544769287,0.9458649158477783,1,0,1,98,"Successful"
"Millionaire Candidates List (AP) AP - Candidates who spent more than  #36;1 million of their own money trying to win election to [[Congress]] in 2004 struck out in nearly every case. Eight made it to the [[Nov]]. 2 election, but only one was [[victorious]]. The spenders, how much they spent and how they fared:","Millionaire Candidates List (AP) AP - Candidates who spent more than  #36;1 million of their own money trying to win election to [[Congreѕs]] in 2004 struck out in nearly every case. Eight made it to the [[N]] [[ov]]. 2 election, but only one was [[victоrious]]. The spenders, how much they spent and how they fared:",0.17879456281661987,0.7614672780036926,0,3,0,60,"Successful"
"[[Apple]] [[Sailing]] on Digital River the iPod -s a nifty little device, primarily allowing you to [[listen]] to downloaded [[music]], but also [[giving]] you the opportunity ","[[Applе]] [[Saiing]] on Digital River the iPod -s a nifty little device, primarily allowing you to [[lsten]] to downloaded [[musiϲ]], but also [[giing]] you the opportunity ",0.2957744598388672,0.6141074895858765,3,2,3,79,"Successful"
