"original_text","perturbed_text","original_score","perturbed_score","original_output","perturbed_output","ground_truth_output","num_queries","result_type"
"This [[documentary]] was neither professionally nor objectively made. The whole thing played out like a conspiracy theory by IBM to win the match in question just to make some money. Garry Kasparov has an ego problem. He was puffed up before the match and when he lost, he didn't like it. I remember playing chess against computers back in the 80s and it wasn't too difficult to win. As time went on, I started to lose and didn't like it. Today, I simply don't play against computers anymore because they're just too good. Not only that, the games are [[uninteresting]] and lack the [[appeal]] of human games, where both sides are more likely to err and open the game to exciting possibilities. This documentary keeps showing us images of The Turk which is an ancient chess playing automaton that was really controlled by a human being. From the start until the end we are lead to believe that IBM short of literally hid a human GM in the back of their cupboard-sized computer. I'm a computer scientist and take [[offense]] at the notion that just because Garry lost, IBM must have cheated. I know how computers play chess. It's not magic and it's no mystery. They can be trained, have huge amounts of chess knowledge and they most certainly see positions and possibilities in unprecedented detail compared to humans. It's really no surprise that Deep Blue won. Perhaps at the time it was. If it happened today, given the ever-increasing processing power of machines; people would hardly blink. If a machine couldn't at least draw with a GM today, people would think the program was weak.","This [[literature]] was neither professionally nor objectively made. The whole thing played out like a conspiracy theory by IBM to win the match in question just to make some money. Garry Kasparov has an ego problem. He was puffed up before the match and when he lost, he didn't like it. I remember playing chess against computers back in the 80s and it wasn't too difficult to win. As time went on, I started to lose and didn't like it. Today, I simply don't play against computers anymore because they're just too good. Not only that, the games are [[uninteres𝚝ing]] and lack the [[appeaⅼ]] of human games, where both sides are more likely to err and open the game to exciting possibilities. This documentary keeps showing us images of The Turk which is an ancient chess playing automaton that was really controlled by a human being. From the start until the end we are lead to believe that IBM short of literally hid a human GM in the back of their cupboard-sized computer. I'm a computer scientist and take [[оffense]] at the notion that just because Garry lost, IBM must have cheated. I know how computers play chess. It's not magic and it's no mystery. They can be trained, have huge amounts of chess knowledge and they most certainly see positions and possibilities in unprecedented detail compared to humans. It's really no surprise that Deep Blue won. Perhaps at the time it was. If it happened today, given the ever-increasing processing power of machines; people would hardly blink. If a machine couldn't at least draw with a GM today, people would think the program was weak.",0.014610528945922852,0.5688788294792175,0,1,0,228,"Successful"
"I [[believe]] that this was supposed to be [[shocking]] or something.... All that I can [[say]] is....POOR GOAT!!! This flick is so [[poorly]] done that the parts that ""should"" shock and revolt you come across as laughable at best. The characters are so [[lame]] and 2....wait....1 dimensional, that I applauded each [[sick]] death.....all except that POOR GOAT.<br /><br />","I [[Ьelieve]] that this was supposed to be [[horrifying]] or something.... All that I can [[tell]] is....POOR GOAT!!! This flick is so [[porly]] done that the parts that ""should"" shock and revolt you come across as laughable at best. The characters are so [[la]] [[me]] and 2....wait....1 dimensional, that I applauded each [[ill]] death.....all except that POOR GOAT.<br /><br />",0.0040953755378723145,0.5164453387260437,0,1,0,136,"Successful"
"[[I]] [[occasionally]] [[let]] my [[kids]] [[watch]] this [[garbage]] so they will understand just how [[pathetic]] the show's ""contestants"" are. They are pathetic not because they are fat, but because they [[whore]] their dignity for a few minutes of fame and fortune.<br /><br />For anyone to [[appear]] on National TV and blubber, sniffle, and whine about being fat ([[entirely]] their own fault) is [[nauseating]]. What does this [[say]] about us as a nation? Does it suggest that your lifestyle choices, and the consequences of them, aren't our responsibility? <[[br]] /><[[br]] />""The Biggest Loser"" is an appropriate [[title]], but it has nothing to do with [[one's]] [[weight]].<br /><br />[[Absolute]] [[trash]].","[[li]] [[seldom]] [[leaving]] my [[children]] [[watcհ]] this [[gaⲅbage]] so they will understand just how [[pathetiϲ]] the show's ""contestants"" are. They are pathetic not because they are fat, but because they [[whoⲅe]] their dignity for a few minutes of fame and fortune.<br /><br />For anyone to [[arise]] on National TV and blubber, sniffle, and whine about being fat ([[entiⲅely]] their own fault) is [[nausea𝚝ing]]. What does this [[tell]] about us as a nation? Does it suggest that your lifestyle choices, and the consequences of them, aren't our responsibility? <[[eb]] /><[[eb]] />""The Biggest Loser"" is an appropriate [[titⅼe]], but it has nothing to do with [[onе's]] [[weighing]].<br /><br />[[Absolue]] [[traѕh]].",0.003903687000274658,0.535274863243103,0,1,0,321,"Successful"
"Do not [[miss]] this [[picture]] that defies [[ages]]. With no [[hesitation]], a [[masterpiece]]. [[Not]] only the script and the [[music]] but also choregraphy, casting,<br /><br />cut : everything [[contributes]] to the perfect achievement. Now nearly 25 years ago and still amazing of [[maturity]], art and<br /><br />sensitivity. Available now in DVD, do not miss either. The transfert is perfect<br /><br />and the sound re-boosted. [[One]] mystery remains about this superb work : why the actors did<br /><br />not succeed better after this flashing start ?","Do not [[misѕ]] this [[pitcure]] that defies [[agеs]]. With no [[timidity]], a [[shaft]]. [[Nope]] only the script and the [[musicians]] but also choregraphy, casting,<br /><br />cut : everything [[contributeѕ]] to the perfect achievement. Now nearly 25 years ago and still amazing of [[m]] [[aturity]], art and<br /><br />sensitivity. Available now in DVD, do not miss either. The transfert is perfect<br /><br />and the sound re-boosted. [[Somebody]] mystery remains about this superb work : why the actors did<br /><br />not succeed better after this flashing start ?",0.006666719913482666,0.5646267533302307,1,0,1,199,"Successful"
"Since I am required to write minimum of 10 lines, and this [[garbage]] [[deserves]] not only a single one, I'll start with the following: 1. I voted AWFUL for this [[dreadful]] so called ""[[movie]]"".<br /><br />2. Let me explain why these turkeys Mr. David Varod produces are shot mainly in my beautiful homeland, Bulgaria (just in BTW, for the illiterate people around - this country is IN EUROPE, based north to Greece and has absolutely nothing to do with Mexico and Uruguay) Some years ago, NU Image has invaded our country and started making [[crappy]] [[mostly]] direct-to-video releases. Why here? Because here they pay [[derisively]] low fees to the Bulgarian crew and to the Bulgarian actors (most of them distinguished ones) which are, in many ways, better than most of their American colleagues. Personally I am [[ashamed]] of that fact. The reason is, of course, the greediness of the Americans involved and their wish to get most, if not all of the profit. Actually it would't be so bad if only the [[production]] wasn't so [[filthy]] and [[pale]]. There hasn't been a good picture shot here for years. At present NU image is being [[sued]] here over the very questionably purchasing of our national cinema production centre called Boyana Films. No doubt about it there has been corruption, there has been deceit, there has been a lies in this recent purchase. The Bulgarian cinema is [[dead]]. Long live the Bulgarian cinema!","Since I am required to write minimum of 10 lines, and this [[gaⲅbage]] [[merits]] not only a single one, I'll start with the following: 1. I voted AWFUL for this [[dreadfuⅼ]] so called ""[[moviе]]"".<br /><br />2. Let me explain why these turkeys Mr. David Varod produces are shot mainly in my beautiful homeland, Bulgaria (just in BTW, for the illiterate people around - this country is IN EUROPE, based north to Greece and has absolutely nothing to do with Mexico and Uruguay) Some years ago, NU Image has invaded our country and started making [[craрpy]] [[mostlу]] direct-to-video releases. Why here? Because here they pay [[derisіvely]] low fees to the Bulgarian crew and to the Bulgarian actors (most of them distinguished ones) which are, in many ways, better than most of their American colleagues. Personally I am [[embarassed]] of that fact. The reason is, of course, the greediness of the Americans involved and their wish to get most, if not all of the profit. Actually it would't be so bad if only the [[produc𝚝ion]] wasn't so [[squalid]] and [[bali]]. There hasn't been a good picture shot here for years. At present NU image is being [[prosecuted]] here over the very questionably purchasing of our national cinema production centre called Boyana Films. No doubt about it there has been corruption, there has been deceit, there has been a lies in this recent purchase. The Bulgarian cinema is [[deaԁ]]. Long live the Bulgarian cinema!",0.003922641277313232,0.5443755388259888,0,1,0,317,"Successful"
"[[This]] oddity contains Bunuel-like touches, but doesn't [[sustain]] one's interest. A 10 year old roams a bizarro America in a stolen Mustang, while the usual cult movie suspects (Dick Miller, Mary Woronov, Susie Tyrell) commit malicious acts in the name of comedy. Like his AFTER HOURS and VAMPIRE'S KISS, the screenwriter delights in making you squirm. I remained unaffected, due to the broad acting. You know you're in for it when Meat Loaf and Flea give the most appealing perfs. (And what did this kid's screen test look like? He's [[insufferable]].) Recommended to the dozen or so fans of SONNY BOY ('87).","[[Tis]] oddity contains Bunuel-like touches, but doesn't [[sustaiո]] one's interest. A 10 year old roams a bizarro America in a stolen Mustang, while the usual cult movie suspects (Dick Miller, Mary Woronov, Susie Tyrell) commit malicious acts in the name of comedy. Like his AFTER HOURS and VAMPIRE'S KISS, the screenwriter delights in making you squirm. I remained unaffected, due to the broad acting. You know you're in for it when Meat Loaf and Flea give the most appealing perfs. (And what did this kid's screen test look like? He's [[insսfferable]].) Recommended to the dozen or so fans of SONNY BOY ('87).",0.011372148990631104,0.5693624019622803,0,1,0,116,"Successful"
"A group of friends receive word from a pal who has found gold in an old mind shaft nearby an ancient abandoned western town of Suttersville. Despite warnings by the local sheriff, Murphy(John Phillip Law), Old Man Prichard(Richard Lynch)a bedraggled hick who swindles tourists with supposed collectible Wanted posters, and kooky superstitious Aunt Nelly(Karen Black)to stay out of the mine due to it's notorious legend(..that an evil coal miner who sold his soul to devil and murdered a priest's(Jeff Conaway)daughter will return from the dead to kill those who remove the gold from his shaft), these people only see the green, not the blood red which could potentially ooze from their slain bodies. Finding the gold of Jeremiah Stone intact, they line their pockets and carrying cases, prepared for the bright futures that supposedly lie ahead. But, when you do not heed the warnings of those you consider backwoods loons, the obvious result will be [[gruesome]] death. Jeremiah Stone, as we see, is lying merely a skeleton near an alter containing skulls lined next to each other as the candles on top of them light up, the pickax underneath awaiting it's master, with dust particles returning him to a grotesque corpse with demonic exposition, his eyes aglow with wrath. This [[hapless]] group, hoping for some fun around the campfire with gold providing them with warm prospects for life ahead, will fall prey to the [[vengeful]] [[ghoul]] and his mean pickax. Another victim will meet the nasty end of a shovel thrown through the windshield of her vehicle, directing it's path straight into her neck. Another failed attempt to retreat has Stone causing a frightened victim to drive his car into a tree, his body engulfed in flames as he fails to escape without harm. Another, a local girl searching for her new friends, worried about their well being, receives the pickax buried into her stomach. Aunt Nelly informs those still alive about the Forty-Niner and the curse on those who raids his eternal stash..and pays the price for relating such information. Will anybody survive? Or, is the entire group fated to perish at the hands of the zombie miner?<br /><br />Make-up effects artist and monster creator, John Carl Buechler directs this supernatural [[slasher]] without worrying about logic or strong story-telling, opting instead to allow his zombie miner to destroy anyone and everyone who happens to be in his path. He provides just enough back story, and this is feeble at best, for the killer allowing special guest star, Karen Black(..oh how her career has sunken into the abyss)to explain to the viewer about him. The story given to us has the miner holding a priest's daughter hostage, threatening to execute her as the Suttersville authorities warn against such an action. Startling enough, Stone plants that pickax right into her back, with the opposition unloading their guns with little effect because he sold his soul to Satan. Retreating to his domain, the mine shaft, Stone sends out a warning against anyone even attempting to take what's his, the loot. Typical of most slashers in general, this bunch of twenty-somethings are your garden variety victims, with little development other than some banter and exchanging of words provides as filler until the undead maniac pops onto the scene to slaughter them. They are the usual group, from the city, trespassing unto unfamiliar territory, resurrecting an evil that should remain dormant. Like many of the later 80's slashers, a good deal of the violence is off-screen. What is on screen, the minimal gore, is rather mundanely presented and happens rather quickly. The ghoul make-up for the killer is only shown occasionally;he's mostly shrouded in darkness, the victims' horrified faces as he catches or chases after them are given more credence than the method of destruction. One thing's for certain, stunt men were set on fire many times. At least three times, a character is burned alive by either a lantern or flaming vehicle. Martin Cove has a minor cameo as Black's former husband, Caleb, now living with a much younger, and dense, honey. Vernon Wells(..of The Road Warrior and Commando fame)has the back story role of Jeremiah Stone as a human, still capturing the same type of menace he specializes in. John Phillip Law seems to be enjoying himself as the rather polite and hospitable sheriff, welcoming the outsiders to his neck of the woods. Buechler has quite an attractive cast of actresses, all wearing tight pants and smallish shirts, showing off their sleek and athletic figures, especially Elina Madison as easy-lay Roxann, always willing to remove her clothes for greedy jerk, Hayden(Rick Majeske). Stephen Wastell(The Ghosts of Edendale) is Axl, a rather clumsy foil, used as a butt of many jokes including his ""dump in the woods"" scene and current unemployment status.","A group of friends receive word from a pal who has found gold in an old mind shaft nearby an ancient abandoned western town of Suttersville. Despite warnings by the local sheriff, Murphy(John Phillip Law), Old Man Prichard(Richard Lynch)a bedraggled hick who swindles tourists with supposed collectible Wanted posters, and kooky superstitious Aunt Nelly(Karen Black)to stay out of the mine due to it's notorious legend(..that an evil coal miner who sold his soul to devil and murdered a priest's(Jeff Conaway)daughter will return from the dead to kill those who remove the gold from his shaft), these people only see the green, not the blood red which could potentially ooze from their slain bodies. Finding the gold of Jeremiah Stone intact, they line their pockets and carrying cases, prepared for the bright futures that supposedly lie ahead. But, when you do not heed the warnings of those you consider backwoods loons, the obvious result will be [[horrific]] death. Jeremiah Stone, as we see, is lying merely a skeleton near an alter containing skulls lined next to each other as the candles on top of them light up, the pickax underneath awaiting it's master, with dust particles returning him to a grotesque corpse with demonic exposition, his eyes aglow with wrath. This [[haplesѕ]] group, hoping for some fun around the campfire with gold providing them with warm prospects for life ahead, will fall prey to the [[vengefuⅼ]] [[undead]] and his mean pickax. Another victim will meet the nasty end of a shovel thrown through the windshield of her vehicle, directing it's path straight into her neck. Another failed attempt to retreat has Stone causing a frightened victim to drive his car into a tree, his body engulfed in flames as he fails to escape without harm. Another, a local girl searching for her new friends, worried about their well being, receives the pickax buried into her stomach. Aunt Nelly informs those still alive about the Forty-Niner and the curse on those who raids his eternal stash..and pays the price for relating such information. Will anybody survive? Or, is the entire group fated to perish at the hands of the zombie miner?<br /><br />Make-up effects artist and monster creator, John Carl Buechler directs this supernatural [[thrillers]] without worrying about logic or strong story-telling, opting instead to allow his zombie miner to destroy anyone and everyone who happens to be in his path. He provides just enough back story, and this is feeble at best, for the killer allowing special guest star, Karen Black(..oh how her career has sunken into the abyss)to explain to the viewer about him. The story given to us has the miner holding a priest's daughter hostage, threatening to execute her as the Suttersville authorities warn against such an action. Startling enough, Stone plants that pickax right into her back, with the opposition unloading their guns with little effect because he sold his soul to Satan. Retreating to his domain, the mine shaft, Stone sends out a warning against anyone even attempting to take what's his, the loot. Typical of most slashers in general, this bunch of twenty-somethings are your garden variety victims, with little development other than some banter and exchanging of words provides as filler until the undead maniac pops onto the scene to slaughter them. They are the usual group, from the city, trespassing unto unfamiliar territory, resurrecting an evil that should remain dormant. Like many of the later 80's slashers, a good deal of the violence is off-screen. What is on screen, the minimal gore, is rather mundanely presented and happens rather quickly. The ghoul make-up for the killer is only shown occasionally;he's mostly shrouded in darkness, the victims' horrified faces as he catches or chases after them are given more credence than the method of destruction. One thing's for certain, stunt men were set on fire many times. At least three times, a character is burned alive by either a lantern or flaming vehicle. Martin Cove has a minor cameo as Black's former husband, Caleb, now living with a much younger, and dense, honey. Vernon Wells(..of The Road Warrior and Commando fame)has the back story role of Jeremiah Stone as a human, still capturing the same type of menace he specializes in. John Phillip Law seems to be enjoying himself as the rather polite and hospitable sheriff, welcoming the outsiders to his neck of the woods. Buechler has quite an attractive cast of actresses, all wearing tight pants and smallish shirts, showing off their sleek and athletic figures, especially Elina Madison as easy-lay Roxann, always willing to remove her clothes for greedy jerk, Hayden(Rick Majeske). Stephen Wastell(The Ghosts of Edendale) is Axl, a rather clumsy foil, used as a butt of many jokes including his ""dump in the woods"" scene and current unemployment status.",0.034754812717437744,0.5342531204223633,0,1,0,567,"Successful"
"I have been a huge Lynn Peterson fan ever since her breakthrough role in the 1988 blockbuster movie ""Far North"", and even though I loved her in her one other film ""Slow"" (2004) where she plays ""Francis"", this is by far and away her strongest role.<br /><br />Lynn, as I'm sure you all know (or should), plays the critical role of ""Driver"".<br /><br />[[Unfortunately]], other than Lynn's amazing performance, I'm afraid this movie doesn't really have much going for it.<br /><br />Oh wait - there was one other thing - the amazing creativity of the editing to remove profanity for TV viewers. Memorable lines like: ""You son-of-a-gun!"", ""You son-of-a-witch!"", ""Shoot!"", and ""Well, Forget You!""<br /><br />O.K. Bye.<br /><br />P.S.: Does anyone know where I can get another Lynn Peterson poster?","I have been a huge Lynn Peterson fan ever since her breakthrough role in the 1988 blockbuster movie ""Far North"", and even though I loved her in her one other film ""Slow"" (2004) where she plays ""Francis"", this is by far and away her strongest role.<br /><br />Lynn, as I'm sure you all know (or should), plays the critical role of ""Driver"".<br /><br />[[Alas]], other than Lynn's amazing performance, I'm afraid this movie doesn't really have much going for it.<br /><br />Oh wait - there was one other thing - the amazing creativity of the editing to remove profanity for TV viewers. Memorable lines like: ""You son-of-a-gun!"", ""You son-of-a-witch!"", ""Shoot!"", and ""Well, Forget You!""<br /><br />O.K. Bye.<br /><br />P.S.: Does anyone know where I can get another Lynn Peterson poster?",0.04632437229156494,0.6232309341430664,0,1,0,113,"Successful"
"I have so much hope for the sequel to Gen-X. Luckily, my hopes have came true. You got a whole bunch of action, comedy...silly comedy, and [[surprises]]. I think the newcomer Edison, is really a hit in the movie, but I really find Sam's 'Alien' stupidly annoying with English. Although the movie had some flaws with the robot graphics and the silly dialogue, the action always keeps it strong. The action set-up is much stronger than the 1st.<br /><br />This movie is getting more of an American feel since 60% of the movie is in English from the Cantonese. This movie will not [[disappoint]] you. I [[recommended]] this for young 'uns that care about pure action-packed fun.<br /><br />","I have so much hope for the sequel to Gen-X. Luckily, my hopes have came true. You got a whole bunch of action, comedy...silly comedy, and [[flabbergasted]]. I think the newcomer Edison, is really a hit in the movie, but I really find Sam's 'Alien' stupidly annoying with English. Although the movie had some flaws with the robot graphics and the silly dialogue, the action always keeps it strong. The action set-up is much stronger than the 1st.<br /><br />This movie is getting more of an American feel since 60% of the movie is in English from the Cantonese. This movie will not [[disappoin𝚝]] you. I [[recomm]] [[ended]] this for young 'uns that care about pure action-packed fun.<br /><br />",0.004183828830718994,0.7894667387008667,1,0,1,130,"Successful"
"I [[thought]] that Eastwood's most [[unusual]] [[role]] was that in [[The]] Bridges of Madison [[County]], but that was until [[I]] [[saw]] The [[Beguiled]]. [[He]] manages to [[pull]] it off, [[giving]] a very good [[performance]] and so does the rest of the cast. [[The]] direction is [[imaginative]] given that the film was made in 1971 and had there not been some [[plot]] holes - which the [[director]] seems to struggle to cover up at times - we [[would]] be [[talking]] about an excellent [[film]]. It [[remains]] powerful, [[nonetheless]].<[[br]] /><[[br]] />8","I [[thoughts]] that Eastwood's most [[curious]] [[roles]] was that in [[To]] Bridges of Madison [[District]], but that was until [[li]] [[watched]] The [[Begu]] [[iled]]. [[It]] manages to [[draw]] it off, [[giѵing]] a very good [[performanϲe]] and so does the rest of the cast. [[Per]] direction is [[imaginatiѵe]] given that the film was made in 1971 and had there not been some [[conspiracies]] holes - which the [[directoⲅ]] seems to struggle to cover up at times - we [[could]] be [[tal𝒌ing]] about an excellent [[fіlm]]. It [[remais]] powerful, [[nonethelesѕ]].<[[re]] /><[[eb]] />8",0.0037214159965515137,0.013744711875915527,1,1,1,372,"Failed"
