"original_text","perturbed_text","original_score","perturbed_score","original_output","perturbed_output","ground_truth_output","num_queries","result_type"
"Even for the non-opera loving public the name CARMEN is immediately recognized as an opera by Bizet about a gypsy girl whose capricious loves destroy men. But as much as the opera is now considered a staple in every opera house repertoire, the real story of the wild gypsy lass as created by Prosper Mérimée in 1845 has never been told as well as in this cinematic version by the abundantly gifted Spanish director Vicente Aranda ('Juana la Loca AKA Mad Love','Amantes', 'If they tell you I fell', etc.). Incorporating the author of the novel as a main character seeking the story of Carmen from one of her lovers - José - [[provides]] just the [[right]] [[vantage]] for the story of this famous gypsy wild lady to be told. <br /><br />Carmen (the amazingly beautiful and talented Paz Vega) works in a cigar factory in Seville, a factory adjoining the military station where the very proper José (Leonardo Sbaraglia) is stationed. Carmen is tempestuous and in a fight instigated by a fellow factory worker bringing attention to the fact that Carmen is a gypsy, Carmen murders the co-worker and is arrested. José is physically attracted to the voluptuous Carmen and when Carmen flirts with him he consents to allow her to escape - his payback is the promise for a night of passion with Carmen. Carmen keeps her pact, providing José with his first sexual encounter, and José is doomed. His lack of military discipline results in his losing his rank and being imprisoned for a while, but at his release José encounters Carmen again, kills a fellow officer, and in fear runs off to the hills to live with the [[smugglers]] and gypsies that are Carmen's people. [[Many]] [[incidents]] occur to try the passionate bond between the lovers, but when Carmen's real husband is released from prison, destructive [[behaviors]] take over, behavior's that include Carmen's infatuation and affair with a bullfighter and the passion of Carmen and José comes to a [[tragic]] end. <br /><br />One factor that makes the story (as adapted for the screen by director Aranda and Joaquim Jordà move so [[well]] is the role that Prosper Mérimée (Jay Benedict) plays: his [[questioning]] of José completes the story that Bizet's opera only outlines. [[The]] acting is [[superb]], the cinematography by Paco Femenia and the [[excellent]] musical [[score]] by José Nieto contribute enormously to the success of this very fine film. This is a must for lovers of the opera Carmen, and a splendid action drama for those viewers who admire historical pieces. Highly recommended. Grady Harp","Even for the non-opera loving public the name CARMEN is immediately recognized as an opera by Bizet about a gypsy girl whose capricious loves destroy men. But as much as the opera is now considered a staple in every opera house repertoire, the real story of the wild gypsy lass as created by Prosper Mérimée in 1845 has never been told as well as in this cinematic version by the abundantly gifted Spanish director Vicente Aranda ('Juana la Loca AKA Mad Love','Amantes', 'If they tell you I fell', etc.). Incorporating the author of the novel as a main character seeking the story of Carmen from one of her lovers - José - [[prоvides]] just the [[proper]] [[vaոtage]] for the story of this famous gypsy wild lady to be told. <br /><br />Carmen (the amazingly beautiful and talented Paz Vega) works in a cigar factory in Seville, a factory adjoining the military station where the very proper José (Leonardo Sbaraglia) is stationed. Carmen is tempestuous and in a fight instigated by a fellow factory worker bringing attention to the fact that Carmen is a gypsy, Carmen murders the co-worker and is arrested. José is physically attracted to the voluptuous Carmen and when Carmen flirts with him he consents to allow her to escape - his payback is the promise for a night of passion with Carmen. Carmen keeps her pact, providing José with his first sexual encounter, and José is doomed. His lack of military discipline results in his losing his rank and being imprisoned for a while, but at his release José encounters Carmen again, kills a fellow officer, and in fear runs off to the hills to live with the [[traffickers]] and gypsies that are Carmen's people. [[Multiple]] [[incidentѕ]] occur to try the passionate bond between the lovers, but when Carmen's real husband is released from prison, destructive [[behaviours]] take over, behavior's that include Carmen's infatuation and affair with a bullfighter and the passion of Carmen and José comes to a [[disastrous]] end. <br /><br />One factor that makes the story (as adapted for the screen by director Aranda and Joaquim Jordà move so [[wlel]] is the role that Prosper Mérimée (Jay Benedict) plays: his [[quеstioning]] of José completes the story that Bizet's opera only outlines. [[Thе]] acting is [[sueprb]], the cinematography by Paco Femenia and the [[e×cellent]] musical [[notation]] by José Nieto contribute enormously to the success of this very fine film. This is a must for lovers of the opera Carmen, and a splendid action drama for those viewers who admire historical pieces. Highly recommended. Grady Harp",0.007924079895019531,0.8999796509742737,1,0,1,472,"Successful"
"[[Wow]]! [[It's]] [[hard]] to [[put]] into [[words]] my [[feelings]] for this [[episode]]. Ice is one of the [[best]] [[episodes]] of [[season]] one for [[sure]]. It's my [[favorite]] of the [[season]]. [[Six]] people and a [[dog]] in a [[claustrophobic]] [[structure]] isolated in the [[middle]] of the [[arctic]] with an [[unknown]] [[organism]] that causes [[murderous]] [[aggression]], the [[drama]] [[can't]] get any better than that. [[Paranoia]] [[reigns]] supreme as [[even]] Mulder and Scully have doubts about each other's [[sanity]]. [[I've]] [[heard]] people complain about this [[episode's]] similarities to the [[movie]] '[[The]] Thing'. I haven't seen it, so I wouldn't [[know]]. Ice is more than worth watching just to [[see]] Mulder and [[Scully]] [[truly]] testing their [[still]] [[developing]] trust of [[one]] [[another]]. [[This]] episode is intense and suspenseful to the [[end]]. You won't be disappointed!","[[Woԝ]]! [[I𝚝's]] [[harԁ]] to [[pose]] into [[phrase]] my [[emotions]] for this [[episoԁe]]. Ice is one of the [[bestest]] [[spells]] of [[bouts]] one for [[persuaded]]. It's my [[favourite]] of the [[episodes]]. [[Vi]] people and a [[hound]] in a [[nightmarish]] [[architecture]] isolated in the [[medium]] of the [[char]] with an [[unnamed]] [[organizations]] that causes [[mortal]] [[aggressoin]], the [[darma]] [[ca]] [[n't]] get any better than that. [[Paranоia]] [[kingdoms]] supreme as [[eveո]] Mulder and Scully have doubts about each other's [[sanitу]]. [[Iv'e]] [[hеard]] people complain about this [[eрisode's]] similarities to the [[move]] '[[To]] Thing'. I haven't seen it, so I wouldn't [[kn]] [[ow]]. Ice is more than worth watching just to [[se]] Mulder and [[Doyle]] [[really]] testing their [[however]] [[formulate]] trust of [[anyone]] [[further]]. [[Tհis]] episode is intense and suspenseful to the [[ends]]. You won't be disappointed!",0.003726482391357422,0.011927962303161621,1,1,1,679,"Failed"
"[[Excellent]] Hitchcock thriller with Robert Cummings proving once again that he could really act up a storm.<br /><br />This time he is a defense plant worker caught up in a horrible plot when his best friend is killed at the plant.<br /><br />Priscilla Lane is the girl who suddenly becomes interested in Cummings as the plot thickens and he is pursued from California to N.Y.<br /><br />There is a diabolical plot by a group of wealthy 5th columnists to destroy from from within. Hitchcock was known to play up the upper echelons of society involved in mayhem in his long career as a director.<br /><br />Ironically, the film implodes at the very end. While we see what happens to the guy who killed Cummings' friend, we don't see what happens to the rest of the gang, again, many of whom represent the upper crust of society.","[[Excelent]] Hitchcock thriller with Robert Cummings proving once again that he could really act up a storm.<br /><br />This time he is a defense plant worker caught up in a horrible plot when his best friend is killed at the plant.<br /><br />Priscilla Lane is the girl who suddenly becomes interested in Cummings as the plot thickens and he is pursued from California to N.Y.<br /><br />There is a diabolical plot by a group of wealthy 5th columnists to destroy from from within. Hitchcock was known to play up the upper echelons of society involved in mayhem in his long career as a director.<br /><br />Ironically, the film implodes at the very end. While we see what happens to the guy who killed Cummings' friend, we don't see what happens to the rest of the gang, again, many of whom represent the upper crust of society.",0.2757189869880676,0.9065109491348267,1,0,1,100,"Successful"
"[[amazing]] movie. Some of the script writing could have been better (some [[cliched]] language). Joyce's ""The [[Dead]]"" is [[alluded]] to [[throughout]] the movie. Beautiful scenery and great acting. Very poetic. [[Highly]] [[recommend]].","[[ɑmazing]] movie. Some of the script writing could have been better (some [[clicheԁ]] language). Joyce's ""The [[Decedent]]"" is [[referred]] to [[troughout]] the movie. Beautiful scenery and great acting. Very poetic. [[Higly]] [[recommеnd]].",0.006930410861968994,0.5705065131187439,1,0,1,139,"Successful"
"This is one of those strange, self-important, self-indulgent movies which tries too hard to be profound. It isn't. Instead, it spouts cliches that try to pass for Profundity. Typical is the scene where Peter (Kelsey Grammer) explains to protagonist and best friend Adam (Dwier Brown) how man starts life breast feeding, then moves on to sucking the breast of his girlfriend, and finally his wife, thus concluding ultimately that life sucks. So deep. We are treated to a variety of characters who offer their perspective of life, the universe, etc. during Adam's travels through the Mojave Desert on foot. (He abruptly leaves L.A. the day of his wedding and his family, friends, and fiance assume he's dead when his car was found in a military test range smashed by a rocket.) Some characters are more entertaining than others. The best by far is an escapee from a mental hospital who only speaks through the voices of others. The actor, James Kevin Ward, does some great impressions, including Nicholson, Popeye, and several characters from the original Star Trek. But once the interesting characters leave the screen, we're stuck with Adam again and his pursuit of the profound. It's a long trip, which drags in many places. In fact, it's the longest hour and a half movie I've ever seen. And the finale [[hardly]] makes it seem worth while, at all.<br /><br />I discovered this movie playing on HBO one day by waking up too early and clicking on the TV. That'll learn me. Next time I'll try harder to sleep in.","This is one of those strange, self-important, self-indulgent movies which tries too hard to be profound. It isn't. Instead, it spouts cliches that try to pass for Profundity. Typical is the scene where Peter (Kelsey Grammer) explains to protagonist and best friend Adam (Dwier Brown) how man starts life breast feeding, then moves on to sucking the breast of his girlfriend, and finally his wife, thus concluding ultimately that life sucks. So deep. We are treated to a variety of characters who offer their perspective of life, the universe, etc. during Adam's travels through the Mojave Desert on foot. (He abruptly leaves L.A. the day of his wedding and his family, friends, and fiance assume he's dead when his car was found in a military test range smashed by a rocket.) Some characters are more entertaining than others. The best by far is an escapee from a mental hospital who only speaks through the voices of others. The actor, James Kevin Ward, does some great impressions, including Nicholson, Popeye, and several characters from the original Star Trek. But once the interesting characters leave the screen, we're stuck with Adam again and his pursuit of the profound. It's a long trip, which drags in many places. In fact, it's the longest hour and a half movie I've ever seen. And the finale [[practically]] makes it seem worth while, at all.<br /><br />I discovered this movie playing on HBO one day by waking up too early and clicking on the TV. That'll learn me. Next time I'll try harder to sleep in.",0.3330145478248596,0.9839036464691162,0,1,0,175,"Successful"
"After repeatedly saying how brilliant so many Columbo episodes are, it's time to honour an episode with maximum points. ""Etude In Black"" is not 100 percent perfect, but it's certainly more than 90 percent...maybe 96 or 97! <br /><br />Last week I reviewed ""Just Married"" and compared it unfavourably to ""Meet The Parents"". Well here's one of the parents, Blythe Danner, in a much earlier role as the wife of famous orchestral conductor Alex Benedict, played by the legend that is John Cassavetes. Alex has been having an affair with Jennifer Wells, a girl in the orchestra (not his first affair, one suspects). She is blackmailing Alex to leave his wife, but as his wife's mother holds the purse strings for the orchestra, Alex doesn't think it'd be such a smart move to destroy his career and marriage overnight. Instead he hatches a plot to sneak out of the concert hall before a performance and murder his young lover while making it look like a suicide.<br /><br />Enter Columbo and guess what? It takes him about two seconds to realise that homicide is more likely than suicide. It doesn't take much longer for Columbo to connect Alex to the victim, and soon he's following him around wherever he goes. Even though Columbo is certain Alex is his man, it actually takes quite a while and a few false leads (none of which Columbo really swallows) before he has the vital piece of evidence.<br /><br />Along the way there are some top-notch extra characters, ranging from the precocious young neighbour of Jennifer Wells and the English mechanic who sounds like he would be more at home on Coronation Street, through to the bedraggled looking brass player who nearly finds himself fitted up for the murder (he had also been seeing Jennifer Wells, the busy girl!). And there's even a brief cameo from Commandant Lassard from the Police Academy films. As with Leslie Nielsen in ""Lady In Waiting"", it's impossible to take him seriously (I bet you're thinking of that speech he made at the podium, aren't you?!) <br /><br />But it's Blythe Danner, John Cassavetes and Peter Falk who steal the show here. Blythe is [[absolutely]] [[divine]] as Mrs Benedict. From the moment she spots Alex dialling Jennifer Wells' number from memory, she feels deeply troubled by exactly what their relationship was. It's a masterful performance as she struggles to trust Alex despite her intuition telling her something is very, very wrong. Columbo doesn't help matters by interrupting her game of tennis to ask her impertinent questions about Alex's relations with members of his orchestra.<br /><br />As for John Cassavetes, well it's a shame he didn't make any repeat appearances as Columbo villains, because he could have been up there with Jack Cassidy and Patrick McGoohan as one of the all-time greats of the show. But this performance is superb! He's another one who falls into the ""highly irritated"" category, losing all patience with Columbo rather than befriending him and indulging him. Despite this, when the game is finally up he does grudgingly acknowledge Columbo's genius.<br /><br />Well it's a really, really fantastic show. It loses a couple of very small points for its rather sledgehammer view of classical music, as highlighted by many of the posters here, but none of these have any bearing on the logic of the story or the characterisations. And at least the music is good, dramatic and exciting!<br /><br />Finally, if you haven't come across it, there is an absolutely amazing clip of John Cassavetes and Peter Falk on the Dick Cavett show from the early 70s. I'm totally convinced Steve Coogan watched this clip and based Alan Partridge on it. Everything about the clip resembles Knowing Me Knowing You, from the cringeworthy introduction to the total humiliation of Cavett by his guests. Even the orchestra get in on the act, playing circus music while Falk, Cassavetes and their friend Ben Gazzara fool about and ridicule the host.<br /><br />It might not be strictly relevant to this review, but the Cavett show clip gives a nice insight into the deep friendship and professional relationship between Peter Falk and John Cassavetes. It's clear to see from the quality of ""Etude In Black"" just how well the pair worked together!","After repeatedly saying how brilliant so many Columbo episodes are, it's time to honour an episode with maximum points. ""Etude In Black"" is not 100 percent perfect, but it's certainly more than 90 percent...maybe 96 or 97! <br /><br />Last week I reviewed ""Just Married"" and compared it unfavourably to ""Meet The Parents"". Well here's one of the parents, Blythe Danner, in a much earlier role as the wife of famous orchestral conductor Alex Benedict, played by the legend that is John Cassavetes. Alex has been having an affair with Jennifer Wells, a girl in the orchestra (not his first affair, one suspects). She is blackmailing Alex to leave his wife, but as his wife's mother holds the purse strings for the orchestra, Alex doesn't think it'd be such a smart move to destroy his career and marriage overnight. Instead he hatches a plot to sneak out of the concert hall before a performance and murder his young lover while making it look like a suicide.<br /><br />Enter Columbo and guess what? It takes him about two seconds to realise that homicide is more likely than suicide. It doesn't take much longer for Columbo to connect Alex to the victim, and soon he's following him around wherever he goes. Even though Columbo is certain Alex is his man, it actually takes quite a while and a few false leads (none of which Columbo really swallows) before he has the vital piece of evidence.<br /><br />Along the way there are some top-notch extra characters, ranging from the precocious young neighbour of Jennifer Wells and the English mechanic who sounds like he would be more at home on Coronation Street, through to the bedraggled looking brass player who nearly finds himself fitted up for the murder (he had also been seeing Jennifer Wells, the busy girl!). And there's even a brief cameo from Commandant Lassard from the Police Academy films. As with Leslie Nielsen in ""Lady In Waiting"", it's impossible to take him seriously (I bet you're thinking of that speech he made at the podium, aren't you?!) <br /><br />But it's Blythe Danner, John Cassavetes and Peter Falk who steal the show here. Blythe is [[utterly]] [[diivne]] as Mrs Benedict. From the moment she spots Alex dialling Jennifer Wells' number from memory, she feels deeply troubled by exactly what their relationship was. It's a masterful performance as she struggles to trust Alex despite her intuition telling her something is very, very wrong. Columbo doesn't help matters by interrupting her game of tennis to ask her impertinent questions about Alex's relations with members of his orchestra.<br /><br />As for John Cassavetes, well it's a shame he didn't make any repeat appearances as Columbo villains, because he could have been up there with Jack Cassidy and Patrick McGoohan as one of the all-time greats of the show. But this performance is superb! He's another one who falls into the ""highly irritated"" category, losing all patience with Columbo rather than befriending him and indulging him. Despite this, when the game is finally up he does grudgingly acknowledge Columbo's genius.<br /><br />Well it's a really, really fantastic show. It loses a couple of very small points for its rather sledgehammer view of classical music, as highlighted by many of the posters here, but none of these have any bearing on the logic of the story or the characterisations. And at least the music is good, dramatic and exciting!<br /><br />Finally, if you haven't come across it, there is an absolutely amazing clip of John Cassavetes and Peter Falk on the Dick Cavett show from the early 70s. I'm totally convinced Steve Coogan watched this clip and based Alan Partridge on it. Everything about the clip resembles Knowing Me Knowing You, from the cringeworthy introduction to the total humiliation of Cavett by his guests. Even the orchestra get in on the act, playing circus music while Falk, Cassavetes and their friend Ben Gazzara fool about and ridicule the host.<br /><br />It might not be strictly relevant to this review, but the Cavett show clip gives a nice insight into the deep friendship and professional relationship between Peter Falk and John Cassavetes. It's clear to see from the quality of ""Etude In Black"" just how well the pair worked together!",0.032178640365600586,0.6140832901000977,1,0,1,454,"Successful"
"This [[movie]] is just about as [[good]] as the [[first]] Jackass, but with [[slightly]] more disgusting [[skits]]. I wouldn't say this was as good as the first, but it came very [[close]]. Jackass fans will not be disappointed, but if you didn't like the [[first]] movie, you will hate this [[one]]. There are scenes that will be seen as [[Jackass]] classics (the elderly suits with ""additions"", the ""[[cab]] ride"", and [[many]] others), and those that you will wish you [[never]] [[watched]] ([[eating]] [[crap]], [[drinking]] [[semen]], etc...) Overall this movie was a good [[watch]], and I am [[glad]] [[I]] got to see it. [[I'm]] sure this movie will not have the best [[rating]] due to critics that rate it ([[I]] sat in the [[press]] section and most of the [[older]] [[viewers]] seemed disgusted), but don't [[let]] that stop you from enjoying it.","This [[mvie]] is just about as [[ɡood]] as the [[fіrst]] Jackass, but with [[sligհtly]] more disgusting [[ski]] [[ts]]. I wouldn't say this was as good as the first, but it came very [[shut]]. Jackass fans will not be disappointed, but if you didn't like the [[fist]] movie, you will hate this [[uno]]. There are scenes that will be seen as [[Knucklehead]] classics (the elderly suits with ""additions"", the ""[[cb]] ride"", and [[maոy]] others), and those that you will wish you [[no]] [[watcheԁ]] ([[dietary]] [[cⲅap]], [[drin𝒌ing]] [[ejaculate]], etc...) Overall this movie was a good [[watϲh]], and I am [[glɑd]] [[l]] got to see it. [[Im]] sure this movie will not have the best [[evaluation]] due to critics that rate it ([[l]] sat in the [[prss]] section and most of the [[old]] [[er]] [[audiences]] seemed disgusted), but don't [[lt]] that stop you from enjoying it.",0.006712377071380615,0.5048475861549377,1,0,1,420,"Successful"
"[[I]] had to [[suffer]] through this movie [[three]] times while I was a [[zombie]] extra in the director's [[new]] [[movie]] [[After]] [[Sundown]]. [[The]] first time that I saw this movie the director was [[standing]] next to me and a clearly [[fake]] and [[cheesy]] [[looking]] [[hand]] popped out of nowhere and grabbed one of the [[characters]]. I [[could]] not take it any more [[I]] [[busted]] out laughing right in front of the [[guy]]. The movie has no direction whatsoever and the one [[thing]] that [[could]] make this movie [[decent]] (Female [[Nudity]]) was nowhere to be found. I am a fan of [[low]] budget horror movies, but this was just too [[much]] for me. The [[worst]] [[part]] was that I had to [[watch]] it so many times. [[Also]] do not [[expect]] the new movie to be any [[better]].","[[j]] had to [[suf]] [[fer]] through this movie [[there]] times while I was a [[vampire]] extra in the director's [[newest]] [[movies]] [[Upon]] [[Bedtime]]. [[Nova]] first time that I saw this movie the director was [[stands]] next to me and a clearly [[fae]] and [[ch]] [[eesy]] [[searching]] [[side]] popped out of nowhere and grabbed one of the [[nature]]. I [[would]] not take it any more [[l]] [[toasted]] out laughing right in front of the [[g]] [[uy]]. The movie has no direction whatsoever and the one [[thiոg]] that [[do]] make this movie [[dеcent]] (Female [[Nudi𝚝y]]) was nowhere to be found. I am a fan of [[meager]] budget horror movies, but this was just too [[highly]] for me. The [[gravest]] [[parties]] was that I had to [[observation]] it so many times. [[Besides]] do not [[waits]] the new movie to be any [[bet]] [[ter]].",0.004196226596832275,0.01853775978088379,0,0,0,540,"Failed"
