"original_text","perturbed_text","original_score","perturbed_score","original_output","perturbed_output","ground_truth_output","num_queries","result_type"
"[[Or]] at [[least]] forceable retirement! This [[movie]] is [[awful]], [[horrible]], terrible, [[rank]], [[rotten]], putrid... [[well]], you [[get]] the [[idea]]. [[Do]] NOT under any [[circumstances]] [[watch]] this piece of [[decaying]] garbage unless you have a death wish, because it's [[sure]] to [[kill]] you. ([[I]] only [[survived]] because I [[missed]] the [[first]] [[half]] [[hour]].) Carrot Top is a [[bad]] comedian, and an even worse [[actor]]. I cannot BELIEVE he got [[anyone]] to [[fund]] this huge [[waste]] of [[time]] and money. It just goes to show that some people have no scruples if they [[think]] they might [[make]] a [[buck]] or [[two]] ([[literally]]... [[I]] can't [[imagine]] this made more than $2!).<[[br]] /><br />[[And]] [[someone]] please tell me what [[possible]] [[motivation]] [[Courtney]] Thorne Smith (a halfway [[decent]] actress, certainly above this at any rate) had for signing [[onto]] this steaming pile of [[dung]]. [[Was]] she THAT bored during that 3.5 [[second]] dry [[spell]] between Melrose Place and Ally [[McBeal]]? Or did she [[owe]] some [[kind]] of karmic debt to the [[Most]] Annoying Person on the Face of the [[Planet]] ([[aka]] [[Carrot]] [[Top]])?<br /><[[br]] />[[I]] give this a 2/10, and that's probably [[way]] too [[high]]. I [[try]] to save my '[[1's]] for [[movies]] that make me vomit, and since [[I]] didn't see all of this [[one]] my [[stomach]] [[contents]] [[thankfully]] [[stayed]] contained. [[I]] don't think I'll be watching it again to find out if it's really [[worth]] a 1!","[[Ord]] at [[lowest]] forceable retirement! This [[move]] is [[dreadful]], [[dreadful]], terrible, [[ranks]], [[r]] [[otten]], putrid... [[allright]], you [[getting]] the [[brainchild]]. [[Doing]] NOT under any [[circum]] [[stances]] [[observation]] this piece of [[decɑying]] garbage unless you have a death wish, because it's [[confident]] to [[assassinated]] you. ([[j]] only [[weathered]] because I [[lacked]] the [[outset]] [[middle]] [[hours]].) Carrot Top is a [[rotten]] comedian, and an even worse [[actress]]. I cannot BELIEVE he got [[someone]] to [[money]] this huge [[debris]] of [[deadline]] and money. It just goes to show that some people have no scruples if they [[believe]] they might [[render]] a [[dollars]] or [[secondly]] ([[virtually]]... [[j]] can't [[imagining]] this made more than $2!).<[[re]] /><br />[[Nor]] [[some]] [[one]] please tell me what [[feasible]] [[motive]] [[Alyssa]] Thorne Smith (a halfway [[proper]] actress, certainly above this at any rate) had for signing [[ontо]] this steaming pile of [[mediocrity]]. [[Became]] she THAT bored during that 3.5 [[sec]] dry [[spelling]] between Melrose Place and Ally [[roseanne]]? Or did she [[should]] some [[type]] of karmic debt to the [[Plus]] Annoying Person on the Face of the [[Globe]] ([[aa]] [[Stick]] [[Supreme]])?<br /><[[ab]] />[[yo]] give this a 2/10, and that's probably [[paths]] too [[higher]]. I [[attempting]] to save my '[[l's]] for [[films]] that make me vomit, and since [[ich]] didn't see all of this [[eden]] my [[abdomen]] [[substances]] [[happily]] [[suspended]] contained. [[l]] don't think I'll be watching it again to find out if it's really [[penalty]] a 1!",0.0039400458335876465,0.007974207401275635,0,0,0,1125,"Failed"
"For a movie shot in 18 days and a budget less than 2 million, this little [[movie]] that could deserves a 'best we could' award. Interesting premise (aside from the usual meteor stuff) with [[solid]] perfs by a cast of familiar faces. 2 thumbs up. Advice to the other reviewer: Don't be afraid to say you liked something.","For a movie shot in 18 days and a budget less than 2 million, this little [[filmmaking]] that could deserves a 'best we could' award. Interesting premise (aside from the usual meteor stuff) with [[soliԁ]] perfs by a cast of familiar faces. 2 thumbs up. Advice to the other reviewer: Don't be afraid to say you liked something.",0.019297122955322266,0.5694897174835205,1,0,1,63,"Successful"
"I watched this film with a bunch of friends at a Halloween party last night. I got to say that the sarcastic comments were never ending and I have to say that they were well deserved. [[Though]] I felt that the directing was done well, the craziness in their dialogue is just a little too much cheese. I think I got about an hour into this before I even started to realize what it was the point was that they were trying to drive home. You catch on pretty quick that this whole family is pretty quirky and something is off about them, it's just a little too slow. This movie could easily have been about 45 minutes and been a lot better. The only thing that made it [[bearable]] was the two bottles of wine that I downed during the course of the flick. [[Bring]] on the slasher films folks, because at least I know what to expect out of them. [[This]] was not my thing, too [[much]] dark [[humour]], and the subject material of cannibalism was a bit explicit and gross. I have to say that Randy Quaid played the part as well as it could have been, and I will give him props for that as I normally see him as a drunken goofball or a washed out fighter pilot who likes to kill aliens.<br /><[[br]] />In conclusion [[I]] give this horror/comedy film a very generous 3 out of 10.","I watched this film with a bunch of friends at a Halloween party last night. I got to say that the sarcastic comments were never ending and I have to say that they were well deserved. [[Thougհ]] I felt that the directing was done well, the craziness in their dialogue is just a little too much cheese. I think I got about an hour into this before I even started to realize what it was the point was that they were trying to drive home. You catch on pretty quick that this whole family is pretty quirky and something is off about them, it's just a little too slow. This movie could easily have been about 45 minutes and been a lot better. The only thing that made it [[barable]] was the two bottles of wine that I downed during the course of the flick. [[Deliver]] on the slasher films folks, because at least I know what to expect out of them. [[Ce]] was not my thing, too [[mu]] [[ch]] dark [[humouⲅ]], and the subject material of cannibalism was a bit explicit and gross. I have to say that Randy Quaid played the part as well as it could have been, and I will give him props for that as I normally see him as a drunken goofball or a washed out fighter pilot who likes to kill aliens.<br /><[[re]] />In conclusion [[ich]] give this horror/comedy film a very generous 3 out of 10.",0.011359930038452148,0.5122461318969727,0,1,0,217,"Successful"
"The first 10 minutes of the movie makes fun of sequels and pg-13 movies. These are the 2 reasons the movie is so [[bad]]. They constantly reference a movie called ""Get Leo"" which is the movie-in-a-movie version of get shorty. Every time they do this, you will be really angry. Travolta isn't very cool, neither is Keitel. However, The Rock and Vince Vaughn are hilarious. They aren't the kind of funny you would expect to see in an Elmore Leonard movie though. If you haven't seen get shorty, you will probably like be cool. If you liked get shorty, you will leave the theater wanting to kill the director and screenwriter. [[Wait]] for the DVD.","The first 10 minutes of the movie makes fun of sequels and pg-13 movies. These are the 2 reasons the movie is so [[baԁ]]. They constantly reference a movie called ""Get Leo"" which is the movie-in-a-movie version of get shorty. Every time they do this, you will be really angry. Travolta isn't very cool, neither is Keitel. However, The Rock and Vince Vaughn are hilarious. They aren't the kind of funny you would expect to see in an Elmore Leonard movie though. If you haven't seen get shorty, you will probably like be cool. If you liked get shorty, you will leave the theater wanting to kill the director and screenwriter. [[Wiat]] for the DVD.",0.010210692882537842,0.5524053573608398,0,1,0,91,"Successful"
"I'm not sure why the [[producers]] needed to trade on the [[name]] of a somewhat successful movie [[franchise]] because the title suggests that it is a sequel to the first three movies..which it is not. Even though [[Marques]] Houston did appear in ""[[HP3]]"", he played a totally different character (he was, eight years older) in this film. Okay...so Reid and Martin weren't the most talented and couldn't carry a film all by themselves..but to trade on the HP franchise seems to me that there [[could]] have made some [[sort]] of reference (albeit minor) to the earlier movies. [[I'm]] sure everyone who wanted to see it was ""[[hoodwinked]]""--into thinking that they were seeing a [[sequel--not]] a totally different film with a familiar name. [[And]] I'm sorry...[[Kym]] Whitley is not [[funny]], and could not hold a candle to the late Robin Harris, Ketty Lester, or DC Curry in the earlier films. Although Meagen Good and Mari Morrow are a substantial visual diversion...I have to give this a THUMBS DOWN!! Just naming the film ""Down to the Last Minute"" would have been OK. Furthermore, the Hudlin brothers (who produced the first three movies) were not involved in the making of this film.","I'm not sure why the [[producеrs]] needed to trade on the [[designation]] of a somewhat successful movie [[honesty]] because the title suggests that it is a sequel to the first three movies..which it is not. Even though [[Maqrues]] Houston did appear in ""[[H3]]"", he played a totally different character (he was, eight years older) in this film. Okay...so Reid and Martin weren't the most talented and couldn't carry a film all by themselves..but to trade on the HP franchise seems to me that there [[wo]] have made some [[sorting]] of reference (albeit minor) to the earlier movies. [[I]] '[[m]] sure everyone who wanted to see it was ""[[հoodwinked]]""--into thinking that they were seeing a [[seqսel--not]] a totally different film with a familiar name. [[A]] [[nd]] I'm sorry...[[K]] [[ym]] Whitley is not [[droll]], and could not hold a candle to the late Robin Harris, Ketty Lester, or DC Curry in the earlier films. Although Meagen Good and Mari Morrow are a substantial visual diversion...I have to give this a THUMBS DOWN!! Just naming the film ""Down to the Last Minute"" would have been OK. Furthermore, the Hudlin brothers (who produced the first three movies) were not involved in the making of this film.",0.012187659740447998,0.5027019381523132,0,1,0,269,"Successful"
"If someone had nudged me about 15 minutes into 'Ray' and asked what I thought of Jamie Foxx in the title role, it would have been time for a blank stare. After all, what is this (fictitious) person talking' about? That wasn't Jamie Foxx up on the big screen. That was Ray Charles. This is one of the [[best]] performances by anybody in recent years. Like the soundtrack, Jamie as Ray is flat-out [[brilliant]].<br /><br />The blind Genius of Soul (who took a revolutionary step of mixing gospel with R&B) died during production. The movie about his troubled life is [[good]], not great. Taylor Hackford's direction and James L. White's script follow the well-worn biopic outline. Super-talented youngster battles adversity, achieves greatness while also self-destructing, then picks himself up out of the gutter for a happy ending. The film shows Charles' flaws (heroin abuse, chronic womanizing, persistent bastard-fathering) even as it sucks you in with his beautiful music.<br /><br />Kerry Washington and Regina King play the main women in Ray's life, one his long-suffering wife and the other his longtime mistress. Both actresses match Foxx stride for stride. What takes him to a different level, though, is his deep understanding and uncanny impersonation of the great musician. The entire cast is [[effective]], especially Sharon Warren as his headstrong mother and Curtis Armstrong as a music exec. Hackford's stars are likely to be rewarded with trophies and---better yet---more starring roles.<br /><br />I was not a Ray Charles aficionado before 'Ray'. Apparently, the film has left out a lot (as do all biopics), but this picture functions as both an old-fashioned crowd pleaser AND a dark investigation of a brilliant/troubled man. For those who whine that Foxx doesn't actually sing (as if that somehow diminishes his performance), take a hike. No mere actor can sing like Mr. Charles anyway. [[You]] can't have everything. What the talented star does in this picture is about as close to ""everything"" as we'll probably see for a while.","If someone had nudged me about 15 minutes into 'Ray' and asked what I thought of Jamie Foxx in the title role, it would have been time for a blank stare. After all, what is this (fictitious) person talking' about? That wasn't Jamie Foxx up on the big screen. That was Ray Charles. This is one of the [[bеst]] performances by anybody in recent years. Like the soundtrack, Jamie as Ray is flat-out [[brіlliant]].<br /><br />The blind Genius of Soul (who took a revolutionary step of mixing gospel with R&B) died during production. The movie about his troubled life is [[goоd]], not great. Taylor Hackford's direction and James L. White's script follow the well-worn biopic outline. Super-talented youngster battles adversity, achieves greatness while also self-destructing, then picks himself up out of the gutter for a happy ending. The film shows Charles' flaws (heroin abuse, chronic womanizing, persistent bastard-fathering) even as it sucks you in with his beautiful music.<br /><br />Kerry Washington and Regina King play the main women in Ray's life, one his long-suffering wife and the other his longtime mistress. Both actresses match Foxx stride for stride. What takes him to a different level, though, is his deep understanding and uncanny impersonation of the great musician. The entire cast is [[efficient]], especially Sharon Warren as his headstrong mother and Curtis Armstrong as a music exec. Hackford's stars are likely to be rewarded with trophies and---better yet---more starring roles.<br /><br />I was not a Ray Charles aficionado before 'Ray'. Apparently, the film has left out a lot (as do all biopics), but this picture functions as both an old-fashioned crowd pleaser AND a dark investigation of a brilliant/troubled man. For those who whine that Foxx doesn't actually sing (as if that somehow diminishes his performance), take a hike. No mere actor can sing like Mr. Charles anyway. [[Vous]] can't have everything. What the talented star does in this picture is about as close to ""everything"" as we'll probably see for a while.",0.016503214836120605,0.516925573348999,1,0,1,276,"Successful"
"The essential message - one which Miller would have surely intended after seeing Vichy war crimes trials - is that [[hatred]] of somebody without rational basis is a waste of life. Meat Loaf's character, Fred, has known Lawrence for many years, and yet when the time comes, at the bidding of his fanatical supporters, he allows them to attack a man who is not part of their ""target"" group. For me, this is the crucial message - it doesn't matter what Lawrence and his wife do from this point onwards - they are marked, and have chance to save themselves by using reason. Animal aggression and anger have blinded Fred's Union thugs to reality.<br /><br />A friend of mine suggested I should see ""The Wave"" to study how irrational hatred and evil ideology can take over people without them realising it. I once conducted an experiment in a role-playing game, and was shocked to see how normal and level-headed people welcomed the creation of an oppressive police state - which would ultimate threaten them all - because it crept in in stages.<br /><br />Fred is the start, his LA friends and preacher idol are the catalyst which pushes his neighbours over the edge into violence without stopping to think that what they are doing in wrong.<br /><br />The relationship between Lawrence and Finkelstein, the Jewish shopkeeper is a [[fascinating]] one, because Lawrence misses the point almost until the end: if the bigots force Finkelstein out, where is he to go? If his family have fled the Nazis, what an irony to be tormented again in the land of ""freedom"".<br /><br />That big poster (it's a fairly famous propaganda piece) about American families enjoying the highest standard of living in the world is a very important detail. When you see this film, watch for the grafitti on the subway train, and all the little posters. The message lurks there too.<br /><br />This movie should be on the curriculum of every school, especially in our time when baseless hatred is being promoted so widely by ""reasonable"" people who are just extremists in thin disguises.","The essential message - one which Miller would have surely intended after seeing Vichy war crimes trials - is that [[hatrеd]] of somebody without rational basis is a waste of life. Meat Loaf's character, Fred, has known Lawrence for many years, and yet when the time comes, at the bidding of his fanatical supporters, he allows them to attack a man who is not part of their ""target"" group. For me, this is the crucial message - it doesn't matter what Lawrence and his wife do from this point onwards - they are marked, and have chance to save themselves by using reason. Animal aggression and anger have blinded Fred's Union thugs to reality.<br /><br />A friend of mine suggested I should see ""The Wave"" to study how irrational hatred and evil ideology can take over people without them realising it. I once conducted an experiment in a role-playing game, and was shocked to see how normal and level-headed people welcomed the creation of an oppressive police state - which would ultimate threaten them all - because it crept in in stages.<br /><br />Fred is the start, his LA friends and preacher idol are the catalyst which pushes his neighbours over the edge into violence without stopping to think that what they are doing in wrong.<br /><br />The relationship between Lawrence and Finkelstein, the Jewish shopkeeper is a [[fasciոating]] one, because Lawrence misses the point almost until the end: if the bigots force Finkelstein out, where is he to go? If his family have fled the Nazis, what an irony to be tormented again in the land of ""freedom"".<br /><br />That big poster (it's a fairly famous propaganda piece) about American families enjoying the highest standard of living in the world is a very important detail. When you see this film, watch for the grafitti on the subway train, and all the little posters. The message lurks there too.<br /><br />This movie should be on the curriculum of every school, especially in our time when baseless hatred is being promoted so widely by ""reasonable"" people who are just extremists in thin disguises.",0.028411805629730225,0.661003589630127,1,0,1,226,"Successful"
"It doesn't matter whether you've experienced the plight of the elderly in America or if you're just plain [[clueless]], Uncle Frank and Matthew Ginsburg give you that [[clue]] in a straight forward, [[funny]], wake up and smell the roses sort of way. By the [[end]] of the [[film]], it is obvious that while being totally entertained, somehow, you've also been educated. A [[terrific]] [[film]], by a terrific up and [[coming]] [[talent]] in the movie field. Matthew Ginsburg is a [[name]] to [[pay]] attention to.","It doesn't matter whether you've experienced the plight of the elderly in America or if you're just plain [[cluеless]], Uncle Frank and Matthew Ginsburg give you that [[cⅼue]] in a straight forward, [[𝚏unny]], wake up and smell the roses sort of way. By the [[terminating]] of the [[filmmaking]], it is obvious that while being totally entertained, somehow, you've also been educated. A [[terrifiϲ]] [[cinema]], by a terrific up and [[upcoming]] [[talents]] in the movie field. Matthew Ginsburg is a [[nae]] to [[remuneration]] attention to.",0.004202723503112793,0.5505802035331726,1,0,1,198,"Successful"
