"original_text","perturbed_text","original_score","perturbed_score","original_output","perturbed_output","ground_truth_output","num_queries","result_type"
"One of the greatest [[lessons]] I ever had in how to watch a movie happened this way: <br /><br />I was working in Roger Corman's offices, like so many other wanabees before and since, I was [[interning]] and trying to figure out how it all worked and how to make myself indispensable ([[hah]]!). One afternoon Julie [[Corman]], Roger Corman's wife and a producer in her own right, asked me to load up a tape. I'm not sure why she wanted to watch it. I got the impression it was a student film or a show reel, something like that, some sort of calling card. Whatever the reasons she had to see it, the only free video machine in the offices at the time happened to be in the room I was working in, and I was the nearest person to the machine. I started the tape.<br /><br />Fade in: On screen a figure sat at a desk facing the camera. Behind him, screen left, was a door that opened into the room. Against the far wall was a coat rack. A second character entered through the door and started talking. The first character, the guy at the desk, turned round to reply, (this is all one take, static camera, there are no cuts [[pans]] or dolly shots. Just one locked off camera). The second character turned to hang his coat on the coat rack and delivered his next line. Julie Corman said ""I've seen [[enough]]."" and left the room.<br /><br />What she had seen in the ten seconds of footage she had watched was that the director was an idiot. Opening with two characters who immediately turned their backs to the camera delivering lines? Nope, sorry. Next! That's how long you've got. Ten seconds. Cock it up in the opening shot and you are [[dead]].<br /><br />I was reminded of that moment while I watched the opening of this piece of [[crap]]. After an interminably long travelogue of jungle we see several monkeys apparently throwing themselves into cages. A man carrying a gun laughs. A jet liner lands and we see it taxi the whole way to the terminal. God this is [[boring]]! [[Cut]] to the [[interior]] of the Airport. Two [[men]] meet. Aha! Something is happening! They shake hands. [[Cut]] to a different angle of the two men -<br /><br />- and the director crosses the line.<br /><br />The first two shots of the movie that have any kind of spatial relationship with each other and the guy has cocked up. 'Not Crossing The line' is one of those basic rules of movie grammar that keeps the characters from jumping about from side to side on the screen and confusing the audience. Audiences don't like to be confused. Mystified? Baffled? Puzzled and intrigued? Yes. Audiences love all of those. Confused? No. You loose them. They walk out. 'Not Crossing The line' is one of those things they pound into you at film school, or should. It's basic stuff. It's not an inviolable rule (there are no inviolable rules) directors break it all the time - but not on the first real cut of the movie.<br /><br />I thought, ""I've seen enough"". And switched off.","One of the greatest [[lessonѕ]] I ever had in how to watch a movie happened this way: <br /><br />I was working in Roger Corman's offices, like so many other wanabees before and since, I was [[interոing]] and trying to figure out how it all worked and how to make myself indispensable ([[ahah]]!). One afternoon Julie [[Coman]], Roger Corman's wife and a producer in her own right, asked me to load up a tape. I'm not sure why she wanted to watch it. I got the impression it was a student film or a show reel, something like that, some sort of calling card. Whatever the reasons she had to see it, the only free video machine in the offices at the time happened to be in the room I was working in, and I was the nearest person to the machine. I started the tape.<br /><br />Fade in: On screen a figure sat at a desk facing the camera. Behind him, screen left, was a door that opened into the room. Against the far wall was a coat rack. A second character entered through the door and started talking. The first character, the guy at the desk, turned round to reply, (this is all one take, static camera, there are no cuts [[bins]] or dolly shots. Just one locked off camera). The second character turned to hang his coat on the coat rack and delivered his next line. Julie Corman said ""I've seen [[enouɡh]]."" and left the room.<br /><br />What she had seen in the ten seconds of footage she had watched was that the director was an idiot. Opening with two characters who immediately turned their backs to the camera delivering lines? Nope, sorry. Next! That's how long you've got. Ten seconds. Cock it up in the opening shot and you are [[dad]].<br /><br />I was reminded of that moment while I watched the opening of this piece of [[cap]]. After an interminably long travelogue of jungle we see several monkeys apparently throwing themselves into cages. A man carrying a gun laughs. A jet liner lands and we see it taxi the whole way to the terminal. God this is [[bornig]]! [[Cu𝚝]] to the [[inside]] of the Airport. Two [[mеn]] meet. Aha! Something is happening! They shake hands. [[Cu𝚝]] to a different angle of the two men -<br /><br />- and the director crosses the line.<br /><br />The first two shots of the movie that have any kind of spatial relationship with each other and the guy has cocked up. 'Not Crossing The line' is one of those basic rules of movie grammar that keeps the characters from jumping about from side to side on the screen and confusing the audience. Audiences don't like to be confused. Mystified? Baffled? Puzzled and intrigued? Yes. Audiences love all of those. Confused? No. You loose them. They walk out. 'Not Crossing The line' is one of those things they pound into you at film school, or should. It's basic stuff. It's not an inviolable rule (there are no inviolable rules) directors break it all the time - but not on the first real cut of the movie.<br /><br />I thought, ""I've seen enough"". And switched off.",0.005680203437805176,0.5170851945877075,0,1,0,489,"Successful"
"[[The]] Comebacks is a [[spoof]] on [[inspirational]] [[sports]] [[movies]], and [[let]] me just [[tell]] you-it is not a [[good]] [[one]]. [[Tom]] Brady (the [[director]]) probably [[found]] it hilarious that [[referencing]] sports films (from [[Gridiron]] Gang, Invincible and [[even]] Miracle! to [[The]] [[Longest]] Yard and Dodgeball-yes Dodgeball!) and tossing in a couple of [[sex]] jokes, would be the funniest [[thing]] since [[Airplane]]! Well, he was [[wrong]]. They did such a [[slipshod]] job, you'd thought it was written in a [[week]]. I have found it that if a [[director]] loves the genre, the [[movie]] will be good. [[Obviously]], Brady does not [[love]] the genre he is [[spoofing]]. This [[movie]] is a [[rancid]] piece of [[garbage]] not [[worth]] [[viewing]], so don't [[see]] it!","[[Nova]] Comebacks is a [[spoo𝚏]] on [[exhilarating]] [[spоrts]] [[film]], and [[leaving]] me just [[te]] [[ll]] you-it is not a [[god]] [[uno]]. [[Tony]] Brady (the [[directoⲅ]]) probably [[foud]] it hilarious that [[reference]] sports films (from [[Redskin]] Gang, Invincible and [[yet]] Miracle! to [[Tհe]] [[Longer]] Yard and Dodgeball-yes Dodgeball!) and tossing in a couple of [[nationality]] jokes, would be the funniest [[𝚝hing]] since [[Plane]]! Well, he was [[wong]]. They did such a [[slipsհod]] job, you'd thought it was written in a [[weeks]]. I have found it that if a [[rector]] loves the genre, the [[filmmaking]] will be good. [[Naturally]], Brady does not [[amour]] the genre he is [[spofing]]. This [[moive]] is a [[obsolete]] piece of [[rubbish]] not [[valuable]] [[viwing]], so don't [[behold]] it!",0.004529118537902832,0.36180078983306885,0,0,0,589,"Failed"
"Alas, another Costner movie that was an hour too long. Credible performances, but the script had no where to go and was in no hurry to get there. First we are offered an [[unrelated]] string of events few of which further the story. Will the [[script]] center on Randall and his wife? Randall and Fischer? How about Fischer and Thomas? In the end, no real front story ever develops and the [[characters]] themselves are [[artificially]] propped up by monologues from third [[parties]]. The [[singer]] explains Randall, Randall [[explains]] Fischer, on and on. Finally, long after you don't care anymore, you will learn something about the script meetings. Three endings were no doubt [[proffered]] and no one could make a decision. The end result? All three were [[used]], one, after another, after another. [[If]] you can hang in past the 100th [[yawn]], you'll be able to pick them out. Despite the [[transparent]] [[attempt]] to [[gain]] [[points]] with a [[dedication]] to the Coast Guard, this [[one]] should have [[washed]] out the very first [[day]].","Alas, another Costner movie that was an hour too long. Credible performances, but the script had no where to go and was in no hurry to get there. First we are offered an [[unrelateԁ]] string of events few of which further the story. Will the [[dashes]] center on Randall and his wife? Randall and Fischer? How about Fischer and Thomas? In the end, no real front story ever develops and the [[trait]] themselves are [[artifіcially]] propped up by monologues from third [[portion]]. The [[singing]] explains Randall, Randall [[clarified]] Fischer, on and on. Finally, long after you don't care anymore, you will learn something about the script meetings. Three endings were no doubt [[brandished]] and no one could make a decision. The end result? All three were [[սsed]], one, after another, after another. [[I𝚏]] you can hang in past the 100th [[yawns]], you'll be able to pick them out. Despite the [[abra]] [[attempting]] to [[gin]] [[things]] with a [[commitments]] to the Coast Guard, this [[eden]] should have [[washeԁ]] out the very first [[today]].",0.009657979011535645,0.5151116847991943,0,1,0,373,"Successful"
"[[In]] this era when almost everything makes it on to DVD (I'm expecting to see the My Mother the Car collection any day now) this film has been unfairly [[neglected]]. There are innumerable stupid comedies from the 60's as well as many other eras that have received at least a cursory DVD treatment. This one wasn't even released on VHS to my knowledge, despite the talents involved in the making (Arthur Hiller, Eli Wallach, Anne Jackson, Murray Shisgal (notable later for co-writing Tootsie), even Dustin Hoffman in his debut). It's obviously a product of the sixties but so is just about everything else from that era. All films reflect the tastes and customs of the times in which they are made. This was released the same year as The President's Analyst, another absurd [[masterpiece]]. That film was finally released on DVD and has developed a cult following. This film has many memorable bizarre, goofy, wacky moments. [[Sure]], it's painted in broad strokes and has silly go-go music throughout but that's [[part]] of its [[charm]]. It creates its own absurd universe. If whoever is in charge of DVD production for Columbia Pictures releases (I believe Columbia released it) takes polls for new releases this gets my vote.","[[Onto]] this era when almost everything makes it on to DVD (I'm expecting to see the My Mother the Car collection any day now) this film has been unfairly [[negligence]]. There are innumerable stupid comedies from the 60's as well as many other eras that have received at least a cursory DVD treatment. This one wasn't even released on VHS to my knowledge, despite the talents involved in the making (Arthur Hiller, Eli Wallach, Anne Jackson, Murray Shisgal (notable later for co-writing Tootsie), even Dustin Hoffman in his debut). It's obviously a product of the sixties but so is just about everything else from that era. All films reflect the tastes and customs of the times in which they are made. This was released the same year as The President's Analyst, another absurd [[mɑsterpiece]]. That film was finally released on DVD and has developed a cult following. This film has many memorable bizarre, goofy, wacky moments. [[Convinced]], it's painted in broad strokes and has silly go-go music throughout but that's [[portion]] of its [[cհarm]]. It creates its own absurd universe. If whoever is in charge of DVD production for Columbia Pictures releases (I believe Columbia released it) takes polls for new releases this gets my vote.",0.0045195817947387695,0.525253176689148,1,0,1,207,"Successful"
"[[This]] [[movie]] is an awesome [[remake]] of the [[original]] by the same title. [[The]] movie was cool,despite the [[fact]], I [[hate]] new [[ones]]! All of the cast was awesome . It has [[great]] cast and an [[awesome]] [[plot]]!! [[The]] [[main]] plot is a man is poisoned and he has to solve his own murder , [[neat]] eh?!Dennis Quaid is the man who is ""D.[[O]].A""(in other [[words]] [[Dead]] [[On]] [[Arrival]]).[[He]] [[finds]] help with his friends, but everyone is now a suspect!!Dennis's character has several hours to find out who poisoned him. The movie is [[quite]] fast and full of action. You can see two other [[big]] stars in [[Meg]] [[Ryan]](City [[Of]] [[Angels]],[[Courage]] [[Under]] Fire) and [[Daniel]] [[Stern]](Home [[Alone]], [[Very]] [[Bad]] Things,Bushwhacked) in supporting roles in this [[awesome]] ,cool remake of a classic movie!!","[[That]] [[moѵie]] is an awesome [[remade]] of the [[initials]] by the same title. [[De]] movie was cool,despite the [[fat]], I [[h]] [[ate]] new [[oneѕ]]! All of the cast was awesome . It has [[awesome]] cast and an [[awesоme]] [[conspiracy]]!! [[Nova]] [[man]] plot is a man is poisoned and he has to solve his own murder , [[super]] eh?!Dennis Quaid is the man who is ""D.[[f]].A""(in other [[expressions]] [[Deaԁ]] [[For]] [[Coming]]).[[His]] [[found]] help with his friends, but everyone is now a suspect!!Dennis's character has several hours to find out who poisoned him. The movie is [[quitе]] fast and full of action. You can see two other [[Ьig]] stars in [[Gretchen]] [[Ran]](City [[Des]] [[Angel]],[[Couⲅage]] [[Undeⲅ]] Fire) and [[Daniеl]] [[Steⲅn]](Home [[Solely]], [[Veⲅy]] [[Rotten]] Things,Bushwhacked) in supporting roles in this [[awesoｍe]] ,cool remake of a classic movie!!",0.00522458553314209,0.6417310237884521,1,0,1,543,"Successful"
"I have a strong [[feeling]] that what you [[think]] of this [[film]] will [[strongly]] [[depend]] on your [[frame]] of [[reference]]. [[If]] you've [[never]] [[seen]] a Miyazaki [[film]] before, then it will [[probably]] [[confuse]] the [[heck]] out of you. If you have [[seen]] a Miyazaki [[film]] before, then it will [[still]] [[probably]] [[confuse]] the [[heck]] out of you....but you won't [[really]] [[care]]! That's because I [[found]] that the [[first]] [[time]] [[I]] [[saw]] one of his animated films, [[I]] [[tried]] too [[hard]] to [[figure]] out what was [[happening]] and [[why--and]] it [[impacted]] my [[enjoyment]] of the [[film]]. [[Now]] that I have [[seen]] just about [[every]] [[Miyazaki]] [[film]], [[I]] [[see]] the bizarreness and just [[take]] it all [[in--enjoying]] the [[beauty]] of it all. [[In]] [[many]] [[ways]], these [[films]] (at [[least]] to [[Western]] [[audiences]]) is like [[drugs--lots]] of [[strange]] and beautiful [[images]] that don't [[always]] [[initially]] make sense but sure [[feel]] great to [[see]]!! [[Of]] all the Miyazaki films, this might have the most [[unusual]] and incomprehensible [[story]] line--even more so than [[SPIRITED]] [[AWAY]] and [[PRINCESS]] MONONOKE or [[MY]] [[NEIGHBOR]] [[TOTORO]]. But, [[like]] these and many other [[Studio]] [[Gibli]] films, if you just [[sit]] [[back]] and [[watch]] you are rewarded with a [[fabulous]] [[tale]]. [[But]], because it is so [[hard]] to [[describe]] (and [[others]] have [[already]] [[done]] so), I won't even go there.<br /><br />As for the [[artwork]], it's very [[typical]] of [[one]] of these Japanese [[films]], [[though]] there was [[one]] noticeable [[change]]. [[There]] was a very extensive [[use]] of what [[looked]] [[like]] [[colored]] [[pencils]] for the [[backgrounds]]. [[This]] was [[NOT]] a [[bad]] thing at [[all--the]] lovely [[pastel-like]] [[look]] was very [[pleasing]] and [[unique]]. [[In]] some ways it [[looked]] [[like]] a [[tiny]] [[bit]] of Bill [[Plympton's]] [[art]] [[style]] was infused into a [[typical]] [[Miyazaki]] [[film]]. [[With]] a [[high]] [[frame-rate]], [[exceptional]] [[character]] [[animation]] (which [[imbued]] them with [[tons]] of [[personality]]) and a great ""[[wow-factor]]"", this is an [[exceptional]] [[film]] for all [[ages]]. [[Though]] [[clearly]] [[designed]] more for [[younger]] [[audiences]] (the [[TOTORO]] [[fans]] [[especially]]), it is a [[bit]] [[scary]] here and there (during the storm segments) but there is [[plenty]] of great [[stuff]] for adults. [[As]] an [[adult]] (at [[least]] [[chronologically]] so), [[I]] loved the [[cute]] [[stuff]] and [[applaud]] the [[other-worldliness]] of the film.<[[br]] /><br />A great film--among Miyazaki's best. I don't give it a 10 because I am hesitant to ever do that--plus I did like a few of the studio's other films a bit more (particularly TOTORO). But that DOESN'T mean you shouldn't rush out now and see it--do it and do yourself a favor.","I have a strong [[impression]] that what you [[thoughts]] of this [[filｍ]] will [[strongⅼy]] [[rely]] on your [[framework]] of [[referencing]]. [[I𝚏]] you've [[nos]] [[viewed]] a Miyazaki [[cinema]] before, then it will [[arguably]] [[confuѕe]] the [[daemon]] out of you. If you have [[watched]] a Miyazaki [[movie]] before, then it will [[however]] [[presumably]] [[confuѕe]] the [[hec𝒌]] out of you....but you won't [[realⅼy]] [[healthcare]]! That's because I [[discovered]] that the [[fist]] [[period]] [[ich]] [[seen]] one of his animated films, [[ich]] [[tired]] too [[stiff]] to [[fig]] out what was [[arising]] and [[why--ad]] it [[influenced]] my [[enjoy]] of the [[filｍ]]. [[Nw]] that I have [[noticed]] just about [[each]] [[Totoro]] [[filｍ]], [[j]] [[admire]] the bizarreness and just [[ta𝒌e]] it all [[in--enϳoying]] the [[beau𝚝y]] of it all. [[At]] [[ｍany]] [[wayѕ]], these [[film]] (at [[leas𝚝]] to [[West]] [[listeners]]) is like [[drugs--lotѕ]] of [[stange]] and beautiful [[imageѕ]] that don't [[permanently]] [[initialⅼy]] make sense but sure [[think]] great to [[look]]!! [[De]] all the Miyazaki films, this might have the most [[exceptional]] and incomprehensible [[stories]] line--even more so than [[FIERY]] [[DISTANCE]] and [[COUNTESS]] MONONOKE or [[MIA]] [[NEIGHBOURING]] [[TOTROO]]. But, [[fond]] these and many other [[Stuԁio]] [[GiЬli]] films, if you just [[si𝚝]] [[returning]] and [[surveillance]] you are rewarded with a [[fabulouѕ]] [[taⅼe]]. [[Nevertheless]], because it is so [[had]] to [[describes]] (and [[other]] have [[because]] [[ԁone]] so), I won't even go there.<br /><br />As for the [[artworks]], it's very [[classic]] of [[eden]] of these Japanese [[filmѕ]], [[𝚝hough]] there was [[someone]] noticeable [[modification]]. [[Sixth]] was a very extensive [[uses]] of what [[sounded]] [[lie]] [[colours]] [[eyeliner]] for the [[backgroundѕ]]. [[Ec]] was [[NOPE]] a [[amiss]] thing at [[all--he]] lovely [[pastel-li𝒌e]] [[lok]] was very [[pleaѕing]] and [[sole]]. [[Iո]] some ways it [[watched]] [[loves]] a [[small]] [[shortly]] of Bill [[Plуmpton's]] [[at]] [[styles]] was infused into a [[typicaⅼ]] [[Kurosawa]] [[movie]]. [[Z]] a [[highest]] [[frme-rate]], [[exceptionaⅼ]] [[traits]] [[cartoon]] (which [[imbibed]] them with [[tоns]] of [[persona]]) and a great ""[[wo-factor]]"", this is an [[exceptionaⅼ]] [[filｍ]] for all [[centuries]]. [[Tough]] [[manifestly]] [[destined]] more for [[youthful]] [[viewers]] (the [[HAYAO]] [[fanѕ]] [[particularly]]), it is a [[bite]] [[scɑry]] here and there (during the storm segments) but there is [[enough]] of great [[stսff]] for adults. [[Because]] an [[adults]] (at [[fewest]] [[chronologicalⅼy]] so), [[l]] loved the [[cutе]] [[stuf𝚏]] and [[applauԁ]] the [[other-worldlinesѕ]] of the film.<[[bⲅ]] /><br />A great film--among Miyazaki's best. I don't give it a 10 because I am hesitant to ever do that--plus I did like a few of the studio's other films a bit more (particularly TOTORO). But that DOESN'T mean you shouldn't rush out now and see it--do it and do yourself a favor.",0.004272818565368652,0.05546307563781738,1,1,1,2936,"Failed"
"This movie has [[got]] to be the [[biggest]] [[disappointment]] [[I've]] ever [[experienced]] with a [[film]]. The acting is [[horrific]], the suspense [[build]] up [[minimal]], and the [[plot]] [[overall]] is [[ridiculous]]. I [[found]] myself rooting for the [[victim]] to just [[hurry]] up and [[become]] a [[victim]], because she [[obviously]] [[needed]] to be put out of her [[misery]]. [[Anyone]] with [[rudimentary]] [[knowledge]] of how the world [[works]] will immediately be [[disgusted]] at the leaps [[we're]] [[asked]] to [[make]] in logic, and the [[so-called]] [[suspenseful]] [[buildup]] [[would]] be lucky to get a 3 year [[old]] to be mildly worried. I'm dismayed that a sequel is planned, because it [[means]] they'll be asking us to once again swallow a sub par plot line. If this is an example of [[Raw]] [[Feed's]] work, I [[think]] I'll be avoiding any and all future [[films]] by them.","This movie has [[did]] to be the [[widest]] [[disappointmeոt]] [[Iv'e]] ever [[endured]] with a [[films]]. The acting is [[horriifc]], the suspense [[construct]] up [[minіmal]], and the [[pot]] [[general]] is [[ridiculouѕ]]. I [[fond]] myself rooting for the [[discriminated]] to just [[haste]] up and [[bceome]] a [[vitim]], because she [[naturally]] [[requisite]] to be put out of her [[miseⲅy]]. [[Everyone]] with [[primeval]] [[acquaintance]] of how the world [[collaborated]] will immediately be [[dismayed]] at the leaps [[we'e]] [[asks]] to [[deliver]] in logic, and the [[so-cɑlled]] [[gripping]] [[accumulation]] [[w]] [[ould]] be lucky to get a 3 year [[archaic]] to be mildly worried. I'm dismayed that a sequel is planned, because it [[mans]] they'll be asking us to once again swallow a sub par plot line. If this is an example of [[Crus]] [[Feeds]] work, I [[tհink]] I'll be avoiding any and all future [[fils]] by them.",0.004337489604949951,0.015123844146728516,0,0,0,576,"Failed"
